Title,Title_link,css-17ubb9w,css-myxawk,css-16nhkrn,Thumbnail,css-15w69y9,css-bc0f0m
"Trump Says Jobs Report Made It a ‘Great Day’ for George Floyd, Stepping on Message",https://www.nytimes.com/2020/06/05/us/politics/trump-jobs-report-george-floyd.html?searchResultPosition=95,June 5,Politics,"The president’s comments on Mr. Floyd, who died after a police officer knelt on his neck for nearly nine minutes, were immediately criticized by Joseph R. Biden Jr., his Democratic opponent.",https://static01.nyt.com/images/2020/06/05/us/politics/05dc-trump/merlin_173234481_68b9e39f-a246-4be4-b2c7-cdb6cf448370-thumbWide.jpg,By Katie Rogers,"PRINT EDITIONPresident Says Job Report Makes ‘a Great Day’ for Floyd|June 6, 2020, Page A16"
I.M.F. Approves Critical Loan for Ukraine,https://www.nytimes.com/2020/06/10/world/europe/imf-ukraine-loan.html?searchResultPosition=96,June 10,Europe,President Volodymyr Zelensky of Ukraine won an endorsement for his anti-corruption policies with the approval of a $5 billion lending program from the International Monetary Fund.,https://static01.nyt.com/images/2020/06/10/world/10ukraine-imf/10ukraine-imf-thumbWide.jpg,By Andrew E. Kramer,"PRINT EDITIONJune 11, 2020"
‘Pandemic Within a Pandemic’: Coronavirus and Police Brutality Roil Black Communities,https://www.nytimes.com/2020/06/07/us/politics/blacks-coronavirus-police-brutality.html?searchResultPosition=97,June 7,Politics,"The current civil unrest is deeply connected to the racial disparities exposed by the coronavirus crisis. “I’m just as likely to die from a cop as I am from Covid,” one organizer said.",https://static01.nyt.com/images/2020/06/07/us/politics/07dc-unrest-virus1/07dc-unrest-virus1-thumbWide.jpg,By Sheryl Gay Stolberg,"PRINT EDITION‘Pandemic Within a Pandemic’ Fuels Unrest|June 8, 2020, Page A20"
‘They Let Us Down’: 5 Takeaways on the C.D.C.’s Coronavirus Response,https://www.nytimes.com/2020/06/03/us/cdc-virus-takeaways.html?searchResultPosition=98,June 3,U.S.,"Early mistakes in testing, aging data systems, clashes with President Trump and an overly cautious culture shook confidence in the nation’s premier public health agency.",https://static01.nyt.com/images/2020/05/31/multimedia/00virus-cdctakeaways-1/merlin_171868707_465030c6-7403-42ce-825d-2e05a6675b12-thumbWide.jpg,By Michael D. Shear,"PRINT EDITIONJune 3, 2020"
Philonise Floyd Speaks Out: ‘I’m Here to Ask You to Make It Stop’,https://www.nytimes.com/2020/06/11/us/politics/philonise-floyd-black-lives-matter.html?searchResultPosition=99,June 11,Politics,Congressional testimony and a new debate over Confederate names: This is your morning tip sheet.,https://static01.nyt.com/images/2020/04/30/us/onpolitics-capitol/onpolitics-capitol-thumbWide-v3.jpg,By Giovanni Russonello,
How Times Reporters Handle Scientific Studies,https://www.nytimes.com/2020/06/09/insider/reporters-scientific-studies.html?searchResultPosition=100,June 9,Times Insider,When is research considered reliable? The answer isn’t always fully known. Here’s the approach our journalists take in evaluating studies and their results.,https://static01.nyt.com/images/2020/06/12/insider/11-insider-science/11-insider-science-thumbWide.jpg,By Emily Palmer,"PRINT EDITIONHow Reporters Treat Scientific Studies|June 12, 2020, Page A2"
Philonise Floyd Speaks Out: ‘I’m Here to Ask You to Make It Stop’,https://www.nytimes.com/2020/06/11/us/politics/philonise-floyd-black-lives-matter.html?searchResultPosition=101,June 11,Politics,Congressional testimony and a new debate over Confederate names: This is your morning tip sheet.,https://static01.nyt.com/images/2020/04/30/us/onpolitics-capitol/onpolitics-capitol-thumbWide-v3.jpg,By Giovanni Russonello,
Trump Administration Faces Bipartisan Calls to End Citizenship Delays,https://www.nytimes.com/2020/06/17/us/coronavirus-naturalization-citizenship-voting.html?searchResultPosition=102,June 17,U.S.,Lawmakers from both parties are urging the Trump administration to conduct the oath remotely to make up for a pause in naturalization ceremonies during the health crisis.,https://static01.nyt.com/images/2020/06/17/us/17virus-naturalization/17virus-naturalization-thumbWide.jpg,By Miriam Jordan,"PRINT EDITIONWith an Election Looming, a Backlog in Citizenship Applications Swells|June 18, 2020, Page A7"
Republicans Will Move Trump Convention Speech Out of Charlotte,https://www.nytimes.com/2020/06/02/us/politics/convention-charlotte-virus-republicans.html?searchResultPosition=103,June 2,Politics,"After a stalemate with Democrats in North Carolina, Republicans said the president wouldn’t accept the party’s nomination at its convention in Charlotte, as planned, but would do so in another city.",https://static01.nyt.com/images/2020/06/02/us/politics/02virus-convention/merlin_110157322_35a5d191-454c-4efe-883f-e7de13360366-thumbWide.jpg,By Annie Karni,"PRINT EDITIONRepublicans Seeking Site To Relocate Convention|June 3, 2020, Page A29"
"Trump ‘Remains Healthy’ After Taking Hydroxychloroquine, His Doctor Says",https://www.nytimes.com/2020/06/03/us/politics/trump-physical-hydroxychloroquine.html?searchResultPosition=104,June 3,Politics,"The president has hailed the drug as a cure for Covid-19, but his own health officials have questioned its effectiveness and safety. His doctor’s comments were part of a summary of the president’s health.",https://static01.nyt.com/images/2020/06/03/us/politics/03dc-trumphealth/03dc-trumphealth-thumbWide.jpg,By Katie Rogers and Lawrence K. Altman,"PRINT EDITIONTrump ‘Remains Healthy’ After Taking Hydroxychloroquine, Doctor Says|June 4, 2020, Page A23"
,,,,,,,
"Despite Big Promises, U.S. Has Delivered Limited Aid in Global Virus Response",https://www.nytimes.com/2020/06/07/us/politics/coronavirus-humanitarian-aid-united-states.html?searchResultPosition=105,June 7,Politics,The State Department and U.S.A.I.D. have spent a fraction of the humanitarian assistance that Congress approved in March to help curb the coronavirus.,https://static01.nyt.com/images/2020/06/07/us/politics/07dc-virus-aid/07dc-virus-aid-thumbWide.jpg,By Lara Jakes,"PRINT EDITIONDespite Big Promises, U.S. Has Delivered Limited Help to Global Virus Response|June 8, 2020, Page A10"
"When Voters Discuss Coronavirus, They’re Really Talking About Trump",https://www.nytimes.com/2020/05/29/us/politics/trump-coronavirus-polls.html?searchResultPosition=106,May 29,Politics,"Even though most people don’t name the coronavirus as their top voting issue, President Trump’s response to the outbreak, and how it’s perceived, will probably swing the election.",https://static01.nyt.com/images/2020/05/29/us/politics/29pollwatch/merlin_172864098_4e331ac7-489f-4400-9166-cd40c91b2255-thumbWide.jpg,By Giovanni Russonello,
Trump Announces That the U.S. Will Withdraw From the W.H.O.,https://www.nytimes.com/video/us/politics/100000007163886/trump-who-coronavirus-china.html?searchResultPosition=107,May 29,Politics,"President Trump said he would terminate the United States’ relationship with the World Health Organization, and repeated past charges that China had mishandled the coronavirus outbreak.",https://static01.nyt.com/images/2020/05/29/business/29virus-us-briefing-trump/29virus-us-briefing-trump-thumbWide.jpg,,
Fed Warns of ‘Extraordinarily Uncertain’ Path to Recovery,https://www.nytimes.com/2020/06/12/business/economy/federal-reserve-economy-coronavirus.html?searchResultPosition=108,June 12,Economy,"Assessing the pandemic’s impact, a Federal Reserve report sees strains on businesses and households and a fragile road back to steady growth and employment.",https://static01.nyt.com/images/2020/06/12/business/12DC-Fed-01/merlin_171561360_42a11aaf-b791-4f15-9347-9dd3418587a8-thumbWide.jpg,By Jeanna Smialek,"PRINT EDITIONRecovery Path Still Uncertain, The Fed Warns|June 13, 2020, Page B3"
Trump Administration Selects Five Coronavirus Vaccine Candidates as Finalists,https://www.nytimes.com/2020/06/03/us/politics/coronavirus-vaccine-trump-moderna.html?searchResultPosition=109,June 3,Politics,"The White House is eager to project progress, but the public-private partnership it has created still faces scientific hurdles, internal tensions and questions from Congress.",https://static01.nyt.com/images/2020/06/03/us/politics/03dc-virus-vaccine1/merlin_171408228_5309746a-b867-4f7e-a307-6dd809656b06-thumbWide.jpg,By Noah Weiland and David E. Sanger,"PRINT EDITIONWhite House Narrows Vaccine Candidates to 5 Companies|June 4, 2020, Page A9"
Trump Postpones G7 Summit and Calls for Russia to Attend,https://www.nytimes.com/2020/05/30/us/politics/trump-g7-russia.html?searchResultPosition=110,May 30,Politics,"The president said he also planned to invite South Korea, Australia and India to the meeting of world leaders in order to discuss China’s future.",https://static01.nyt.com/images/2020/05/31/us/30dc-trumpG7-print/merlin_173005566_94d28105-dca6-4f8e-b54c-81b8bfce0c19-thumbWide.jpg,By Maggie Haberman,"PRINT EDITIONTrump Pushes G7 Meeting to September, and Vows to Invite Some Unusual Guests|May 31, 2020, Page A9"
Biden’s Testing Strategy Sets Up a Clear Contrast With Trump on the Coronavirus,https://www.nytimes.com/2020/05/28/us/politics/biden-trump-coronavirus-testing.html?searchResultPosition=111,May 28,Politics,"While the president has left testing responsibilities to the states, his Democratic rival would harness the power of the federal government to drive testing down to the workplace.",https://static01.nyt.com/images/2020/05/27/us/politics/27dc-virus-testing1/merlin_172866744_92c79b43-ae15-4b90-a617-4c242c3bf4bf-thumbWide.jpg,By Sheryl Gay Stolberg,"PRINT EDITIONBiden Test Plan  Rejects Strategy  Of the President|May 29, 2020, Page A1"
Don’t Bar Ex-Offenders From Coronavirus Aid Funds,https://www.nytimes.com/2020/06/02/opinion/coronavirus-ppp-loan-felons.html?searchResultPosition=112,June 2,Opinion,The Trump administration unilaterally excluded those with criminal records from loan programs. The decision should be reversed.,https://static01.nyt.com/images/2020/06/02/opinion/02Vance/02Vance-thumbWide.jpg,By Cyrus R. Vance Jr.,
Donald Trump Is Lost in Space,https://www.nytimes.com/2020/06/02/opinion/donald-trump-is-lost-in-space.html?searchResultPosition=113,June 2,Opinion,The president is incapable of summoning the better angels of our nature. He doesn’t even seem to know what they are.,https://static01.nyt.com/images/2020/06/02/opinion/02convoWeb/02convoWeb-thumbWide.jpg,By Gail Collins and Bret Stephens,
Biden Calls Trump a ‘Fool’ for Not Wearing Mask in Coronavirus Crisis,https://www.nytimes.com/2020/05/26/us/politics/joe-biden-facemasks-trump-coronavirus.html?searchResultPosition=114,May 26,Politics,"Joseph Biden, in his first in-person interview since the virus curtailed his campaign, suggested the president was being “falsely masculine’’ by refusing to wear a mask.",https://static01.nyt.com/images/2020/05/26/us/politics/26biden/merlin_172826340_eb74e52b-7eab-4843-8515-d5a6d84d5e20-thumbWide.jpg,By Sydney Ember,"PRINT EDITIONBiden Calls Trump ‘Fool’ For Opting Out of Mask|May 27, 2020, Page A22"
,,,,,,,
"U.S. Limits Virus Aid for Masks, Gloves and Other Medical Gear Abroad",https://www.nytimes.com/2020/06/09/us/politics/coronavirus-international-aid-masks.html?searchResultPosition=115,June 9,Politics,But the U.S. Agency for International Development will allow relief workers to buy personal protective equipment that is produced in the places it would be used.,https://static01.nyt.com/images/2020/06/09/us/politics/09dc-virus-aid-sub/merlin_172345629_b78dc369-12c0-4dae-a50b-635c1230685b-thumbWide.jpg,By Lara Jakes,"PRINT EDITIONU.S. Agency Limits Funding  For Supplies Sent Abroad|June 10, 2020, Page A7"
Senate Confirms Inspector General to Oversee Virus Bailout Funds,https://www.nytimes.com/2020/06/02/us/politics/virus-bailout-inspector-general.html?searchResultPosition=116,June 2,Politics,"Brian D. Miller, the White House lawyer tapped to oversee the Treasury Department’s $500 billion fund, has said he would not be influenced by political pressure.",https://static01.nyt.com/images/2020/06/02/us/politics/02dc-virus-miller-sub/02dc-virus-miller-sub-thumbWide.jpg,By Alan Rappeport,"PRINT EDITIONJune 3, 2020"
The Medical Mask Becomes a Protest Symbol,https://www.nytimes.com/2020/06/02/arts/virus-mask-trump.html?searchResultPosition=117,June 2,Arts,Commentators on the right have tried to paint the mask as a cowardly affectation. A flood of masked demonstrators tells a different story.,https://static01.nyt.com/images/2020/06/03/arts/02VIRUS-MASK1/02VIRUS-MASK1-thumbWide.jpg,By Amanda Hess,"PRINT EDITIONBehind The Mask? Civic Action|June 3, 2020, Page C1"
Trump Thinks He’s 2020’s ‘Law and Order’ Candidate. He’s Not.,https://www.nytimes.com/2020/06/02/opinion/floyd-trump-nixon-coronavirus.html?searchResultPosition=118,June 2,Opinion,Trump’s plan to campaign as the second coming of Richard Nixon shows the limits of historical analogy. It’s not 1968.,https://static01.nyt.com/images/2020/06/02/opinion/02bouieWeb/02bouieWeb-thumbWide.jpg,By Jamelle Bouie,"PRINT EDITIONTrump Is No ‘Law-and-Order’ Nixon|June 3, 2020, Page A31"
It’s Trump vs. Twitter,https://www.nytimes.com/2020/05/29/business/dealbook/trump-twitter-social-media.html?searchResultPosition=119,May 29,DealBook,President Trump is taking aim at social networks over treatment of his tweets. Twitter responded by putting a warning on another of his posts.,https://static01.nyt.com/images/2020/05/29/business/29db-newsletter-trumptweet2/merlin_172932753_d7eef7b8-8889-4285-9baf-01c2289915aa-thumbWide.jpg,,"PRINT EDITIONMay 30, 2020"
ISIS Attacks Surge in Iraq Amid Debate on U.S. Troop Levels,https://www.nytimes.com/2020/06/10/world/middleeast/iraq-isis-strategic-dialogue-troops.html?searchResultPosition=120,June 10,Middle East,The growing pressure on the United States to reduce its military presence in Iraq comes as strikes by the Islamic State are on the rise.,https://static01.nyt.com/images/2020/06/09/world/09iraq4/09iraq4-thumbWide-v2.jpg,"By Alissa J. Rubin, Lara Jakes and Eric Schmitt","PRINT EDITIONISIS Attacks Surge In Iraq Amid Debate On U.S. Troop Levels|June 11, 2020, Page A11"
"Embattled at Home, Trump Finds Himself Isolated Abroad, Too",https://www.nytimes.com/2020/06/02/world/europe/trump-merkel-allies.html?searchResultPosition=121,June 2,Europe,"After years of snubs and American unilateralism, European allies have stopped looking to the president for leadership, and are turning their backs on him.",https://static01.nyt.com/images/2020/06/02/world/02trump-isolation/02trump-isolation-thumbWide-v2.jpg,By Steven Erlanger,"PRINT EDITIONFacing Strife at Home, Trump Finds No Refuge With European Leaders|June 3, 2020, Page A12"
Coronavirus to Shave Trillions From the Economy Over 10 Years,https://www.nytimes.com/2020/06/01/us/politics/coronavirus-economy.html?searchResultPosition=122,June 1,Politics,"The Congressional Budget Office projects a nearly $16 trillion hit to the gross domestic product over the next decade, $7.9 trillion after adjusting for inflation.",https://static01.nyt.com/images/2020/06/01/us/politics/01dc-virus-econ1/01dc-virus-econ1-thumbWide.jpg,By Emily Cochrane,"PRINT EDITIONPandemic to Carve $16 Trillion Out of American Economy Over 10 Years|June 2, 2020, Page A6"
"Rebuking China, Trump Curtails Ties to Hong Kong and Severs Them With W.H.O.",https://www.nytimes.com/2020/05/29/us/politics/trump-hong-kong-china-WHO.html?searchResultPosition=123,May 29,Politics,Critics say the actions would do little to blunt China’s influence and could ultimately hurt the U.S. and others.,https://static01.nyt.com/images/2020/05/29/us/politics/29dc-trump-china-sub2/merlin_172963713_432a1d64-8598-4457-aa62-f6df31633e4f-thumbWide.jpg,"By Michael Crowley, Edward Wong and Ana Swanson","PRINT EDITIONTrump to Strip Hong Kong Ties, Punishing China|May 30, 2020, Page A1"
"Gretchen Whitmer: The Coronavirus Is a Civil Rights Battle, Too",https://www.nytimes.com/2020/06/02/opinion/gretchen-whitmer-coronavirus-george-floyd.html?searchResultPosition=124,June 2,Opinion,George Floyd’s death and the pandemic both reveal American infections. Why is the federal government undermining my fight against them?,https://static01.nyt.com/images/2020/06/03/opinion/03Whitmer/03Whitmer-thumbWide.jpg,By Gretchen Whitmer,"PRINT EDITIONWe Need  A Vaccine For Racism|June 3, 2020, Page A31"
,,,,,,,
"Amid Pandemic and Upheaval, New Cyberthreats to the Presidential Election",https://www.nytimes.com/2020/06/07/us/politics/remote-voting-hacking-coronavirus.html?searchResultPosition=125,June 7,Politics,"Fear of the coronavirus is speeding up efforts to allow voting from home, but some of them pose security risks and may make it easier for Vladimir V. Putin, or others, to hack the vote.",https://static01.nyt.com/images/2020/06/08/multimedia/08cybervote1/08cybervote1-thumbWide-v2.jpg,"By David E. Sanger, Nicole Perlroth and Matthew Rosenberg","PRINT EDITIONStates Scramble As Hackers Eye Remote Voting  |June 8, 2020, Page A1"
"Blaming China for Pandemic, Trump Says U.S. Will Leave the W.H.O.",https://www.nytimes.com/2020/05/29/health/virus-who.html?searchResultPosition=126,May 29,Health,America’s decades-long relationship with the organization has been instrumental in improving health around the world.,https://static01.nyt.com/images/2020/05/29/science/29VIRUS-WHO1/29VIRUS-WHO1-thumbWide.jpg,By Donald G. McNeil Jr. and Andrew Jacobs,"PRINT EDITIONTrump Says U.S. Is Leaving W.H.O., but Experts Aren’t So Sure|May 30, 2020, Page A6"
U.S. and Chinese Scientists Trace Evolution of Coronaviruses in Bats,https://www.nytimes.com/2020/06/01/science/coronavirus-bats-wuhan.html?searchResultPosition=127,June 1,Science,Researchers whose canceled U.S. grant caused an outcry from other scientists urge preventive monitoring of viruses in southwestern China.,https://static01.nyt.com/images/2020/06/01/science/01VIRUS-BATS/01VIRUS-BATS-thumbWide-v2.jpg,By James Gorman,"PRINT EDITIONScientists Trace Evolution  Of Coronaviruses in Bats|June 2, 2020, Page A6"
Trump Will Have His Coronation,https://www.nytimes.com/2020/05/27/opinion/coronavirus-trump-north-carolina.html?searchResultPosition=128,May 27,Opinion,"If North Carolina won’t host the Republican Party’s convention, he’ll find a state that will.",https://static01.nyt.com/images/2020/05/27/opinion/27cottleWeb/27cottleWeb-thumbWide.jpg,By Michelle Cottle,"PRINT EDITIONMay 29, 2020, Page A26"
The C.D.C. Waited ‘Its Entire Existence for This Moment.’ What Went Wrong?,https://www.nytimes.com/2020/06/03/us/cdc-coronavirus.html?searchResultPosition=129,June 3,U.S.,"The technology was old, the data poor, the bureaucracy slow, the guidance confusing, the administration not in agreement. The coronavirus shook the world’s premier health agency, creating a loss of confidence and hampering the U.S. response to the crisis.",https://static01.nyt.com/images/2020/06/03/multimedia/00virus-cdc-3/00virus-cdc-3-thumbWide-v2.jpg,"By Eric Lipton, Abby Goodnough, Michael D. Shear, Megan Twohey, Apoorva Mandavilli, Sheri Fink and Mark Walker","PRINT EDITIONBuilt for This, C.D.C. Shows Flaws in Crisis|June 3, 2020, Page A1"
"As Virus Toll Preoccupies U.S., Rivals Test Limits of American Power",https://www.nytimes.com/2020/06/01/us/politics/coronavirus-global-competition-russia-china-iran-north-korea.html?searchResultPosition=130,June 1,Politics,"The coronavirus may have changed almost everything, but it didn’t change this: Global competition spins ahead — and in many ways has accelerated.",https://static01.nyt.com/images/2020/06/02/us/politics/31dc-virus-globalcompetition-pix1/31dc-virus-globalcompetition-pix1-thumbWide.jpg,"By David E. Sanger, Eric Schmitt and Edward Wong","PRINT EDITIONAs Toll Preoccupies U.S., Rivals Test the Limits of American Power|June 2, 2020, Page A5"
Where the Virus Is Growing Most: Countries With ‘Illiberal Populist’ Leaders,https://www.nytimes.com/2020/06/02/briefing/coronavirus-populist-leaders.html?searchResultPosition=131,June 2,Briefing,"Brazil, Russia, Britain and the U.S. have something in common.",https://static01.nyt.com/images/2020/06/21/world/31virus-leadership1/31virus-leadership1-thumbWide-v3.jpg,By David Leonhardt and Lauren Leatherby,"PRINT EDITIONNations Led by Populists See Fastest Virus Spread|June 5, 2020, Page A6"
Beyond Georgia: A Warning for November as States Scramble to Expand Vote-by-Mail,https://www.nytimes.com/2020/06/10/us/politics/voting-by-mail-georgia.html?searchResultPosition=132,June 10,Politics,Turnout has remained high as states have raced to allow voting by mail. But getting a full count on Election Day looks increasingly difficult.,https://static01.nyt.com/images/2020/06/10/us/10VOTEBYMAIL-atlanta/merlin_173386293_5fc8a963-2b03-43a5-996e-027114568a18-thumbWide.jpg,By Nick Corasaniti and Michael Wines,"PRINT EDITIONLost or Folded Ballots, Then the Tallying Slog: Hiccups in Mail Voting|June 11, 2020, Page A17"
Senate Gives Final Approval to Revisions to Small-Business Program,https://www.nytimes.com/2020/06/03/us/politics/coronavirus-senate-small-business-program.html?searchResultPosition=133,June 3,Politics,"The legislation now heads to the president’s desk, just days before some businesses will run out of time to spend the loan money.",https://static01.nyt.com/images/2020/06/03/us/politics/03dc-cong/merlin_171728655_a2646240-d2b5-47a9-86fb-0a14c66da1db-thumbWide.jpg,By Emily Cochrane,"PRINT EDITION Senate Passes Bill to Assist Firms Racing To Use Loans|June 4, 2020, Page A9"
China Steps Back in Airline Dispute With the Trump Administration,https://www.nytimes.com/2020/06/03/business/trump-china-flights-ban.html?searchResultPosition=134,June 3,Business,Beijing will allow limited flights by international carriers to resume after the White House threatened to block Chinese passenger jets from flying to the U.S.,https://static01.nyt.com/images/2020/06/03/business/03chinaflights2/03chinaflights2-thumbWide.jpg,"By Niraj Chokshi, Ana Swanson and Vivian Wang","PRINT EDITIONIn Retaliatory Move, U.S. Will Bar Flights, In or Out, by Chinese Passenger Airlines|June 4, 2020, Page A13"
,,,,,,,
"At Cape Canaveral, Trump’s Search for a Heroic Narrative Is Thwarted",https://www.nytimes.com/2020/05/27/us/politics/trump-spacex-launch.html?searchResultPosition=135,May 27,Politics,The president had hoped to watch the first launch of NASA astronauts into orbit from the United States in nearly a decade. Nothing would say the U.S. is back with more verve than a rocket’s red glare.,https://static01.nyt.com/images/2020/05/27/us/politics/27dc-trump/27dc-trump-thumbWide.jpg,By Peter Baker and Michael D. Shear,"PRINT EDITIONTrump’s Moment of Liftoff Fizzles in the Florida Rain|May 28, 2020, Page A21"
"As Protests Engulf the United States, China Revels in the Unrest",https://www.nytimes.com/2020/06/02/world/asia/china-george-floyd.html?searchResultPosition=136,June 2,Asia Pacific,Chinese officials and state media are seizing on the moment to tout Beijing’s authoritarian system and condemn American hypocrisy — a narrative that ignores many of their own issues.,https://static01.nyt.com/images/2020/06/02/world/02unrest-china-topsub/merlin_173048415_580ac3b6-371a-41bb-a977-b1b6a9c4ba84-thumbWide.jpg,By Javier C. Hernández,"PRINT EDITIONChina Revels as Unrest Spreads Across U.S.|June 3, 2020, Page A12"
Border Wall Land Grabs Accelerate as Owners Shelter From Pandemic,https://www.nytimes.com/2020/05/29/us/politics/border-wall-coronavirus.html?searchResultPosition=137,May 29,Politics,"With private property proving hard to acquire, the administration has stepped up efforts to secure land on the Mexican border for President Trump’s wall.",https://static01.nyt.com/images/2020/05/28/us/politics/28dc-wall1/merlin_164028420_0a517eaa-112d-41de-85ac-e39666870263-thumbWide.jpg,By Zolan Kanno-Youngs,"PRINT EDITIONWith Owners Trapped Indoors, U.S. Grabs Land to Build Wall|May 30, 2020, Page A1"
Falwell’s Blackface Tweet Brings Racial Dissent to Liberty University,https://www.nytimes.com/2020/06/08/us/politics/jerry-falwell-blackface.html?searchResultPosition=138,June 8,Politics,"A tweet by Liberty University’s president, Jerry Falwell Jr., has sparked an angry protest in the evangelical college’s community and a rare apology from Mr. Falwell.",https://static01.nyt.com/images/2020/06/08/us/politics/08dc-unrest-falwell1/merlin_170924823_8f978a2f-0d95-42bf-bb49-3720a4ec9aa4-thumbWide.jpg,By Elizabeth Williamson,"PRINT EDITIONFalwell’s Blackface Tweet Roils Liberty Campus, Prompting Calls to Resign|June 9, 2020, Page A18"
Mourning Alone,https://www.nytimes.com/2020/05/28/us/politics/coronavirus-100000-trump-biden.html?searchResultPosition=139,May 28,Politics,"As the coronavirus death toll crosses 100,000, Americans have been left without a consoler in chief.",https://static01.nyt.com/images/2020/05/28/us/28onpolitics-pm/28onpolitics-pm-thumbWide-v2.jpg,By Lisa Lerer,
"Trump Tweets and Golfs, but Makes No Mention of Virus’s Toll",https://www.nytimes.com/2020/05/24/us/politics/trump-coronavirus-death-toll.html?searchResultPosition=140,May 24,Politics,"Coronavirus deaths in the United States approached a staggering 100,000, a number the president once predicted would never be reached.",https://static01.nyt.com/images/2020/05/24/us/politics/24dc-virus-trumptoll1/merlin_172793832_7456bbe5-e356-4e68-a0e0-529efc30da97-thumbWide.jpg,By Peter Baker,"PRINT EDITIONTrump Stays Quiet on Toll As U.S. Nears a Milestone|May 25, 2020, Page A1"
