Title,Title_link,css-17ubb9w,css-myxawk,css-16nhkrn,Thumbnail,css-15w69y9,css-bc0f0m
"Trump Tweets and Golfs, but Makes No Mention of Virus’s Toll",https://www.nytimes.com/2020/05/24/us/politics/trump-coronavirus-death-toll.html?searchResultPosition=141,May 24,Politics,"Coronavirus deaths in the United States approached a staggering 100,000, a number the president once predicted would never be reached.",https://static01.nyt.com/images/2020/05/24/us/politics/24dc-virus-trumptoll1/merlin_172793832_7456bbe5-e356-4e68-a0e0-529efc30da97-thumbWide.jpg,By Peter Baker,"PRINT EDITIONTrump Stays Quiet on Toll As U.S. Nears a Milestone|May 25, 2020, Page A1"
"In Days of Discord, a President Fans the Flames",https://www.nytimes.com/2020/05/30/us/politics/trump-george-floyd-protests.html?searchResultPosition=142,May 30,Politics,"Mr. Trump has presented himself as someone who seeks conflict, not conciliation, a fighter, not a peacemaker. And he has lived up to his self-image at a perilous time.",https://static01.nyt.com/images/2020/05/31/us/politics/30dc-virus-assess/30dc-virus-assess-thumbWide.jpg,By Peter Baker,"PRINT EDITIONPresident Needles as America Burns|May 31, 2020, Page A1"
Black Americans Have a Message for Democrats: Not Being Trump Is Not Enough,https://www.nytimes.com/2020/05/31/us/politics/black-americans-democrats-trump.html?searchResultPosition=143,May 31,Politics,"Joe Biden wants to heal the soul of the country in this moment of protest and loss, and win the White House. Simply telling people to vote in November may not help with either goal.",https://static01.nyt.com/images/2020/05/31/us/politics/31blackvoters1/merlin_172997895_3d26a583-0eec-4fef-b55f-7b6ee5ab366a-thumbWide.jpg,By Astead W. Herndon,"PRINT EDITIONBlack Voters to Democrats: Normal Won’t Do|June 1, 2020, Page A1"
The Brutal Clarity of the Trump-McConnell Plan to Protect Businesses,https://www.nytimes.com/2020/05/25/opinion/trump-mcconnell-reopening.html?searchResultPosition=144,May 25,Opinion,The liability-protection ruse is an excuse to coerce Americans back to work by refusing desperately needed help.,https://static01.nyt.com/images/2020/05/25/opinion/25Wilkenson/25Wilkenson-thumbWide.jpg,By Will Wilkinson,"PRINT EDITIONThe Brutal Clarity of the Trump-McConnell Plan|May 26, 2020, Page A23"
,,,,,,,
They Predicted ‘The Crisis of 2020’ … in 1991. So How Does This End?,https://www.nytimes.com/2020/05/28/us/politics/coronavirus-republicans-trump.html?searchResultPosition=145,May 28,Politics,"Two scholars coined the term millennial and developed a fan base for their grim theories. Now, the surviving one sees a generational realignment happening in American politics that does not bode well for Republicans.",https://static01.nyt.com/images/2020/05/29/us/politics/00howe/00howe-thumbWide.jpg,By Jeremy W. Peters,"PRINT EDITION‘The Crisis of 2020,’ Predicted in 1991: What’s Next?|May 29, 2020, Page A18"
Crisis in the Liberal City,https://www.nytimes.com/2020/06/02/opinion/george-floyd-protests-city.html?searchResultPosition=146,June 2,Opinion,The George Floyd protests expose the fault lines in metropolitan America.,https://static01.nyt.com/images/2020/06/02/opinion/02douthatWeb/02douthatWeb-thumbWide.jpg,By Ross Douthat,
Fight Over G.O.P. Convention Escalates in North Carolina,https://www.nytimes.com/2020/05/28/us/politics/republican-convention-trump-north-carolina.html?searchResultPosition=147,May 28,Politics,President Trump has pushed state leaders to hold the kind of event he wants. Top Republicans and the state’s Democratic governor traded demands this week over safety measures.,https://static01.nyt.com/images/2020/05/28/us/politics/28gop-convention1/28gop-convention1-thumbWide.jpg,By Maggie Haberman and Annie Karni,"PRINT EDITIONG.O.P. Gives North Carolina Deadline for Convention Plan|May 29, 2020, Page A20"
Sparring and Schedules Offer Glimpse of Pandemic’s Partisan Lens,https://www.nytimes.com/2020/05/29/us/coronavirus-us-usa.html?searchResultPosition=148,May 29,U.S.,"The White House directly challenges the House’s new rules. President Trump plans to resume in-person fund-raising soon. New York City, Washington and Los Angeles plan to lift some restrictions.",https://static01.nyt.com/images/2020/05/29/us/politics/29virus-us-congress-testify/29virus-us-congress-testify-thumbWide.jpg,,
"In Audacious Move, Georgia and Florida Governors Offer to Host G.O.P. Convention",https://www.nytimes.com/2020/05/26/us/politics/republican-convention-trump.html?searchResultPosition=149,May 26,Politics,"The party is still contractually obligated to hold the event in North Carolina, but President Trump has threatened a change of location as the state’s Democratic governor urges caution because of the coronavirus.",https://static01.nyt.com/images/2020/05/26/us/politics/26gop-convention/26gop-convention-thumbWide.jpg,By Maggie Astor,"PRINT EDITIONAs North Carolina Hesitates, 2 States Offer to Host G.O.P.|May 27, 2020, Page A19"
"Remember, No One Is Coming to Save Us",https://www.nytimes.com/2020/05/30/opinion/sunday/trump-george-floyd-coronavirus.html?searchResultPosition=150,May 30,Sunday Review,"Eventually doctors will find a coronavirus vaccine, but black people will continue to wait for a cure for racism.",https://static01.nyt.com/images/2020/05/31/opinion/sunday/29Gay/29Gay-thumbWide.jpg,By Roxane Gay,"PRINT EDITIONRemember, No One’s Coming to Save Us|May 31, 2020, Page SR3"
Does a Crisis Spur Political Unity? Not This Pandemic,https://www.nytimes.com/2020/05/28/us/coronavirus-political-unity-crisis.html?searchResultPosition=151,May 28,U.S.,"Insults, accusations and shaming characterize the current political environment even as leaders must come together at some point.",https://static01.nyt.com/images/2020/05/28/us/politics/28dc-virus-hulse1/merlin_172885923_dc8d2455-9b93-4b8b-998d-07b18e26db52-thumbWide.jpg,By Carl Hulse,"PRINT EDITIONMeeting the Moment With Sniping and Spite|May 29, 2020, Page A19"
On the Economics of Not Dying,https://www.nytimes.com/2020/05/28/opinion/coronavirus-economy-death.html?searchResultPosition=152,May 28,Opinion,What good is increasing G.D.P. if it kills you?,https://static01.nyt.com/images/2020/05/28/opinion/28krugmanWeb/28krugmanWeb-thumbWide.jpg,By Paul Krugman,"PRINT EDITIONMay 29, 2020, Page A26"
Trump Says He Is ‘Considering’ Hosting G7 Summit at Camp David,https://www.nytimes.com/2020/05/20/us/politics/trump-g7-coronavirus.html?searchResultPosition=153,May 20,Politics,"In a tweet, the president said that gathering world leaders in person would be a sign of “normalization.” None immediately rejected the idea.",https://static01.nyt.com/images/2020/05/20/multimedia/20dc-virus-trump/merlin_172687362_b8f47c69-5c06-4767-9ce6-26b4ad4e914c-thumbWide.jpg,By Michael Crowley,"PRINT EDITIONTrump Wants G7 Leaders To Meet at Camp David|May 21, 2020, Page A10"
Trump Suggests Virus Death Count Is Inflated. Most Experts Doubt It,https://www.nytimes.com/2020/05/22/us/politics/coronavirus-trump-death-toll.html?searchResultPosition=154,May 22,Politics,"Senior White House and health officials have sought new ways to find the extent of infections and deaths, questioning whether official counts are inflating the toll of the virus.",https://static01.nyt.com/images/2020/05/21/us/politics/21dc-virus-data1/merlin_172397064_82b86ee5-0f50-4689-b4b6-89062b7387cb-thumbWide.jpg,"By Noah Weiland, Maggie Haberman and Abby Goodnough","PRINT EDITIONMost Health Experts Doubt Trump’s Suggestion That U.S. Death Count Is Inflated|May 23, 2020, Page A7"
,,,,,,,
"In Michigan Visit, Trump Forgoes Criticism and Talks About the Economy and the Flood",https://www.nytimes.com/2020/05/21/us/politics/trump-michigan-visit.html?searchResultPosition=155,May 21,Politics,"Touring a Ford plant, he donned a mask but then took it off because he “didn’t want to give the press the pleasure of seeing it.”",https://static01.nyt.com/images/2020/05/21/us/politics/21dc-Trump/merlin_172720545_e7efcabd-3bcc-44a1-ab9d-ee835aaf039d-thumbWide.jpg,By Annie Karni,"PRINT EDITIONTrump Curbs His Earlier Criticism During a Visit to Crucial Michigan|May 22, 2020, Page A7"
Prominent Scientists Denounce End to Coronavirus Grant,https://www.nytimes.com/2020/05/21/health/wuhan-coronavirus-laboratory.html?searchResultPosition=156,May 21,Health,A group of 77 Nobel laureates wants the U.S. government to review a grant cancellation for research in China directly related to preventing pandemics.,https://static01.nyt.com/images/2020/05/21/science/21VIRUS-LAUREATES1/21VIRUS-LAUREATES1-thumbWide.jpg,By James Gorman,"PRINT EDITIONMay 22, 2020"
Trump Is Playing the China Card. Who Believes Him?,https://www.nytimes.com/2020/05/19/opinion/trump-biden-china.html?searchResultPosition=157,May 19,Opinion,He attacks Joe Biden to deflect blame for his terrible handling of Covid-19 and record of appeasing Beijing.,https://static01.nyt.com/images/2020/05/19/opinion/19Rice/19Rice-thumbWide.jpg,By Susan E. Rice,"PRINT EDITIONTrump’s Desperate China Gambit|May 20, 2020, Page A27"
Scientists Question Validity of Major Hydroxychloroquine Study,https://www.nytimes.com/2020/05/29/health/coronavirus-hydroxychloroquine.html?searchResultPosition=158,May 29,Health,Experts demanded verification of data and methods used in a study of drugs to treat Covid-19. The study suggested the drugs might have increased deaths.,https://static01.nyt.com/images/2020/05/29/science/29virus-study/29virus-study-thumbWide.jpg,By Roni Caryn Rabin,"PRINT EDITIONMore Than 100 Scientists Question Validity of Major Hydroxychloroquine Study|May 30, 2020, Page A8"
"He Says Trumps Cost Him $2 Million, but Hotelier Now Cheers Federal Assist",https://www.nytimes.com/2020/05/22/us/hotel-coronavirus-trump.html?searchResultPosition=159,May 22,U.S.,Plans to launch a brand of Trump hotels in Mississippi fizzled when the president’s family business walked away. Now a former partner has received  coronavirus relief loans as he completes the project.,https://static01.nyt.com/images/2020/05/23/us/politics/23virus-trumphotelpartner/oovirus-trumphotelpartner-thumbWide.jpg,By Steve Eder and Ben Protess,"PRINT EDITIONAbandoned By Trumps,  He Gets Aid|May 23, 2020, Page B1"
How We Broke the World,https://www.nytimes.com/2020/05/30/opinion/sunday/coronavirus-globalization.html?searchResultPosition=160,May 30,Sunday Review,Greed and globalization set us up for disaster.,https://static01.nyt.com/images/2020/05/31/opinion/sunday/31friedman-top/31friedman-top-thumbWide.jpg,By Thomas L. Friedman,"PRINT EDITIONMay 31, 2020, Page SR4"
Trump’s Press Secretary Displays One of His Checks in a Little Too Much Detail,https://www.nytimes.com/2020/05/22/us/politics/coronavirus-trump-press-secretary-check.html?searchResultPosition=161,May 22,Politics,"The $100,000 check was made out to a government agency. This time his account and routing numbers were clearly visible.",https://static01.nyt.com/images/2020/05/22/us/politics/22dc-virus-check/22dc-virus-check-thumbWide-v2.jpg,By Annie Karni,"PRINT EDITIONCheck Shows Trump’s Account Data, Too|May 23, 2020, Page A10"
In Praise of Fallible Leaders,https://www.nytimes.com/2020/05/25/opinion/trump-biden-president.html?searchResultPosition=162,May 25,Opinion,We need a president who can admit it when he’s wrong.,https://static01.nyt.com/images/2020/05/26/opinion/26krugmanprint1/25krugmanWeb-thumbWide.jpg,By Paul Krugman,"PRINT EDITIONMay 26, 2020, Page A22"
Malaria Drug Taken by Trump Is Tied to Increased Risk of Heart Problems and Death in New Study,https://www.nytimes.com/2020/05/22/health/malaria-drug-trump-coronavirus.html?searchResultPosition=163,May 22,Health,"The drugs did not help coronavirus patients, and should not be used outside clinical trials, researchers said.",https://static01.nyt.com/images/2020/05/22/science/22VIRUS-HCQ/22VIRUS-HCQ-thumbWide.jpg,By Denise Grady,"PRINT EDITIONMalaria Drugs Raised Risks Of Heart Issues In New Study|May 23, 2020, Page A10"
Trump’s Inaccurate Claims on Hydroxychloroquine,https://www.nytimes.com/2020/05/21/us/politics/trump-fact-check-hydroxychloroquine-coronavirus-.html?searchResultPosition=164,May 21,Politics,"The president falsely described scientific research around the malaria drug, falsely denied the existence of a federal warning against it and argued, with no evidence, that large numbers of health care workers were taking it.",https://static01.nyt.com/images/2020/05/21/us/politics/21dc-virus-factcheck/21dc-virus-factcheck-thumbWide.jpg,By Linda Qiu,"PRINT EDITIONTrump’s Inaccurate Claims On Hydroxychloroquine|May 22, 2020, Page A9"
,,,,,,,
Crumbs for the Hungry but Windfalls for the Rich,https://www.nytimes.com/2020/05/23/opinion/sunday/coronavirus-economic-response.html?searchResultPosition=165,May 23,Sunday Review,Billions are going to zillionaires under the guise of pandemic relief.,https://static01.nyt.com/images/2020/05/24/opinion/24Kristof/24Kristof-thumbWide.jpg,By Nicholas Kristof,"PRINT EDITIONCrumbs for the Hungry, Windfalls for the Rich|May 24, 2020, Page SR9"
"For Spy Agencies, Briefing Trump Is a Test of Holding His Attention",https://www.nytimes.com/2020/05/21/us/politics/presidents-daily-brief-trump.html?searchResultPosition=166,May 21,Politics,President Trump’s intelligence briefings have gotten renewed attention since he blamed them for failing to sound the alarm early on about the coronavirus.,https://static01.nyt.com/images/2020/05/11/us/politics/11dc-intel1-copy/11dc-intel1-copy-thumbWide.jpg,By Julian E. Barnes and Adam Goldman,"PRINT EDITIONTrump, Diverting Virus Blame, Points Finger at a Messenger|May 22, 2020, Page A1"
‘This Is Not the Hunger Games’: National Testing Strategy Draws Concerns,https://www.nytimes.com/2020/05/25/health/coronavirus-testing-trump.html?searchResultPosition=167,May 25,Health,The Trump administration’s report to Congress sees states taking responsibility for coronavirus testing with federal guidance.,https://static01.nyt.com/images/2020/05/25/science/25virus-testing/merlin_172457271_1322e237-76a5-428d-ac0b-b55d596e5c11-thumbWide.jpg,By Apoorva Mandavilli and Catie Edmondson,"PRINT EDITIONMay 26, 2020"
America Is a Tinderbox,https://www.nytimes.com/2020/05/29/opinion/george-floyd-protests-minneapolis.html?searchResultPosition=168,May 29,Opinion,Scenes from a country in free fall.,https://static01.nyt.com/images/2020/05/30/opinion/sunday/30Goldberg1/30Goldberg1-thumbWide.jpg,By Michelle Goldberg,
Trump Sows Doubt on Voting. It Keeps Some People Up at Night.,https://www.nytimes.com/2020/05/24/us/politics/trump-2020-election-voting-rights.html?searchResultPosition=169,May 24,Politics,"A group of worst-case scenario planners — mostly Democrats, but also some anti-Trump Republicans — have been gaming out how to respond to various doomsday options for the 2020 presidential election.",https://static01.nyt.com/images/2020/05/25/us/politics/24doomsday1/24doomsday1-thumbWide.jpg,By Reid J. Epstein,"PRINT EDITIONHow Far Would Trump Go to Keep Job? Foes Brainstorm Options|May 25, 2020, Page A18"
It’s My 100th Birthday. It’s Been Quite a Century.,https://www.nytimes.com/2020/05/23/opinion/coronavirus-100-years-old.html?searchResultPosition=170,May 23,Opinion,"I grew up in the Great Depression and served in World War II. Trust me when I say America will survive this crisis, too.",https://static01.nyt.com/images/2020/05/21/opinion/21rowse1/21rowse1-thumbWide.jpg,By Arthur E. Rowse,
Pressure Mounts Over Calls for Guantánamo’s Most Isolated Prisoners,https://www.nytimes.com/2020/05/29/us/politics/coronavirus-guantanamos-isolated-prisoners.html?searchResultPosition=171,May 29,Politics,"Amid the coronavirus pandemic, two judges have ordered the government to arrange classified calls between some detainees and their lawyers, or explain why not.",https://static01.nyt.com/images/2020/05/30/us/politics/30dc-gitmo/merlin_160679034_cb35a6a3-ba84-425f-bb87-5f98aeb4529c-thumbWide.jpg,By Carol Rosenberg,"PRINT EDITIONOrder May Let Lawyers Call Guantánamo Detainees|May 30, 2020, Page A6"
What to Know About the Malaria Drug Trump Says He Is Using,https://www.nytimes.com/article/hydroxychloroquine-coronavirus.html?searchResultPosition=172,May 18,U.S.,"Here are the facts on hydroxychloroquine, which the president has promoted to fight Covid-19 despite warnings from the F.D.A. that it can cause heart problems.",https://static01.nyt.com/images/2020/05/18/multimedia/18xp-virus-Hydroxychloroquine1/18xp-virus-Hydroxychloroquine1-thumbWide.jpg,"By Denise Grady, Katie Thomas, Patrick J. Lyons and Neil Vigdor","PRINT EDITIONWhat Is Hydroxychloroquine? Facts About the Drug Trump Is Taking|May 20, 2020, Page A11"
"As Trump Pushes for Reopenings, Congregations Choose Safety Over Haste",https://www.nytimes.com/2020/05/24/us/coronavirus-church-trump.html?searchResultPosition=173,May 24,U.S.,Houses of worship are balancing the desire to reopen and worship together against the health consequences of moving too fast.,https://static01.nyt.com/images/2020/05/24/us/24virus-churches-1/24virus-churches-1-thumbWide.jpg,By Rick Rojas and Elizabeth Dias,"PRINT EDITIONMany Congregations Preach Caution as Discourse on Reopening Becomes Political|May 25, 2020, Page A8"
"Four Months After First Case, U.S. Death Toll Passes 100,000",https://www.nytimes.com/2020/05/27/us/coronavirus-live-news-updates.html?searchResultPosition=174,May 27,U.S.,Scientists are revising the timeline of how the virus spread. Education Secretary Betsy DeVos said she would direct public school districts to share federal aid with private schools.,https://static01.nyt.com/images/2020/05/25/us/25virus-briefing-deats/merlin_172798662_63cb2a93-730a-4176-aaab-d421f45a5e4c-thumbWide.jpg,,
,,,,,,,
Donald Trump Doesn’t Want Authority,https://www.nytimes.com/2020/05/19/opinion/coronavirus-trump-orban.html?searchResultPosition=175,May 19,Opinion,The coronavirus crisis offered the president an opportunity to consolidate power. It turns out he only wants attention.,https://static01.nyt.com/images/2020/05/19/opinion/19douthatWeb/19douthatWeb-thumbWide.jpg,By Ross Douthat,
China’s Hong Kong Crackdown Could Put Trump in an Unwelcome Spot,https://www.nytimes.com/2020/05/21/us/politics/trump-china-hong-kong.html?searchResultPosition=176,May 21,Politics,A proposed new security law has senators calling for sanctions. But the president is reluctant to jeopardize his ties to President Xi Jinping.,https://static01.nyt.com/images/2020/05/21/us/politics/21dc-chinareact/21dc-chinareact-thumbWide.jpg,By Michael Crowley and Edward Wong,"PRINT EDITIONMay 22, 2020, Page A16"
Reopening Optimism Helps Wall Street,https://www.nytimes.com/2020/05/27/business/stock-market-today-coronavirus.html?searchResultPosition=177,May 27,Business,The latest on stock market and business news during the coronavirus outbreak.,https://static01.nyt.com/images/2020/05/27/business/27virus-markets-briefing-wallst/merlin_172731732_28654f56-1172-4b40-80e7-1268073bff61-thumbWide.jpg,,"PRINT EDITIONMay 27, 2020"
We’ve Got Way Too Many Trumps,https://www.nytimes.com/2020/05/20/opinion/trump-children.html?searchResultPosition=178,May 20,Opinion,"The next generation’s terrible trio, and two we’ll leave alone.",https://static01.nyt.com/images/2020/05/20/opinion/20collins1/20collins1-thumbWide.jpg,By Gail Collins,"PRINT EDITIONMay 21, 2020, Page A26"
Trump Looks Forward to the Return of Sports With Crowds,https://www.nytimes.com/2020/05/17/sports/golf/rory-mcilroy-trump-pga.html?searchResultPosition=179,May 17,Golf,The president called in to the broadcast of the golf tour’s first live TV event since the coronavirus pandemic shuttered tournaments.,https://static01.nyt.com/images/2020/05/17/sports/17golf-trump/17golf-trump-thumbWide.jpg,By Bill Pennington,"PRINT EDITIONDuring Event, Trump Says He Looks Forward to ‘Big Stadiums Loaded With People’|May 18, 2020, Page D2"
"Trump Says He’s Taking Hydroxychloroquine, Prompting Warning From Health Experts",https://www.nytimes.com/2020/05/18/us/politics/trump-hydroxychloroquine-covid-coronavirus.html?searchResultPosition=180,May 18,Politics,"His announcement drew immediate criticism from a range of medical experts, who warned not just of the dangers it posed for the president’s health but also of the example it set.",https://static01.nyt.com/images/2020/05/18/us/politics/18dc-virus-trump1/18dc-virus-trump1-thumbWide-v3.jpg,By Annie Karni and Katie Thomas,"PRINT EDITIONPresident Says He Takes Drug Deemed a Risk|May 19, 2020, Page A1"
Trump Looks Forward to the Return of Sports With Crowds,https://www.nytimes.com/2020/05/17/sports/golf/rory-mcilroy-trump-pga.html?searchResultPosition=181,May 17,Golf,The president called in to the broadcast of the golf tour’s first live TV event since the coronavirus pandemic shuttered tournaments.,https://static01.nyt.com/images/2020/05/17/sports/17golf-trump/17golf-trump-thumbWide.jpg,By Bill Pennington,"PRINT EDITIONDuring Event, Trump Says He Looks Forward to ‘Big Stadiums Loaded With People’|May 18, 2020, Page D2"
On Politics: Putting a Stamp (or Not) on Vote-by-Mail,https://www.nytimes.com/2020/05/21/us/politics/trump-mail-voting.html?searchResultPosition=182,May 21,Politics,"President Trump makes false claims, and Mike Pompeo faces scrutiny: This is your morning tip sheet.",https://static01.nyt.com/images/2020/03/26/us/onpolitics-2020-eyeballs-icon/onpolitics-2020-eyeballs-icon-thumbWide.jpg,By Giovanni Russonello,
"Firing a Salvo in Culture Wars, Trump Pushes for Churches to Reopen",https://www.nytimes.com/2020/05/22/us/politics/trump-churches-coronavirus.html?searchResultPosition=183,May 22,Politics,"President Trump threatened to overrule states that refuse to open places of worship. The White House could not explain how he has that power, and legal experts said he did not have such authority.",https://static01.nyt.com/images/2020/05/22/us/politics/22dc-trumpvid-sub/22dc-trumpvid-sub-thumbWide-v2.jpg,By Peter Baker,"PRINT EDITIONFiring Salvo in Culture Wars,  Trump Wants Churches Open  |May 23, 2020, Page A1"
"Supreme Court, in 5-4 Decision, Rejects Church’s Challenge to Shutdown Order",https://www.nytimes.com/2020/05/30/us/supreme-court-churches-coronavirus.html?searchResultPosition=184,May 30,U.S.,A California church argued that restrictions on public gatherings treated houses of worship worse than many businesses.,https://static01.nyt.com/images/2020/05/31/us/politics/31dc-virus-scotus/merlin_170520402_b9c7ce69-5b2d-4627-8957-1a866d9d9b06-thumbWide.jpg,By Adam Liptak,"PRINT EDITIONJustices Uphold Limits On Religious Services During Health Crisis|May 31, 2020, Page A9"
,,,,,,,
How Many Covid Deaths? Don’t Ask President Trump,https://www.nytimes.com/2020/05/17/opinion/coronavirus-us-death-toll.html?searchResultPosition=185,May 17,Opinion,The president has expressed skepticism about the fatality figures reported to him by his own experts.,https://static01.nyt.com/images/2020/05/18/opinion/18deathtoll1/merlin_171555681_4cfe3ea5-0957-454e-9b45-23231c9c4434-thumbWide.jpg,By The Editorial Board,"PRINT EDITIONThe Death Toll? Don’t Ask Mr. Trump|May 18, 2020, Page A22"
"Trump Steps Up Attacks on Mail Vote, Making False Claims About Fraud",https://www.nytimes.com/2020/05/20/us/politics/trump-michigan-vote-by-mail.html?searchResultPosition=186,May 20,Politics,"President Trump initially said he might withhold federal funding for Michigan and Nevada if the states moved forward in expanding vote by mail, though he later backed off that threat.",https://static01.nyt.com/images/2020/05/20/us/politics/20trump-voting/20trump-voting-thumbWide-v5.jpg,"By Reid J. Epstein, Nick Corasaniti and Annie Karni","PRINT EDITIONFalsely Citing Fraud, President Ratchets Up Attacks on Mail Voting|May 21, 2020, Page A22"
My Futile Struggle for Stillness,https://www.nytimes.com/2020/05/24/opinion/coronavirus-mexico-usa.html?searchResultPosition=187,May 24,Opinion,"I am isolating in a Mexican village, alternating between being impressed by my capacity for serenity and wanting to strangle myself for descending into triteness of Eat, Pray, Love proportions.",https://static01.nyt.com/images/2020/05/24/opinion/24fernandez/24fernandez-thumbWide.jpg,By Belen Fernandez,
G.O.P. Officials Quietly Consider Paring Back Convention,https://www.nytimes.com/2020/05/21/us/politics/republican-convention-trump.html?searchResultPosition=188,May 21,Politics,President Trump has insisted that the Republican convention is moving ahead for August despite the coronavirus. But even he has expressed openness to a scaled-down event.,https://static01.nyt.com/images/2020/05/21/us/politics/21gop-convention/21gop-convention-thumbWide-v2.jpg,By Maggie Haberman and Annie Karni,"PRINT EDITIONG.O.P. Officials Consider Paring Back Convention|May 22, 2020, Page A18"
I Expected War. I Didn’t Expect Trump’s Impeachment or a Pandemic.,https://www.nytimes.com/2020/05/20/opinion/volodymyr-zelensky-ukraine-coronavirus.html?searchResultPosition=189,May 20,Opinion,Ukraine’s president looks back at what got him through his first year in office.,https://static01.nyt.com/images/2020/05/20/opinion/20zelensky/20zelensky-thumbWide.jpg,By Volodymyr Zelensky,"PRINT EDITIONMay 20, 2020"
Biden Says Trump ‘Surrendered’ to Coronavirus in Blistering Speech,https://www.nytimes.com/2020/06/30/us/politics/biden-speech-trump-coronavirus.html?searchResultPosition=1,June 30,Politics,"President Trump’s Democratic opponent criticized him for failing to protect the American people from the virus, as it continues to surge in many parts of the country.",https://static01.nyt.com/images/2020/06/30/us/politics/30virus-biden1/merlin_174085896_5586475f-cf09-4838-8fe1-a9769800fa13-thumbWide.jpg,By Matt Stevens and Thomas Kaplan,"PRINT EDITIONBiden, in Blistering Speech, Says Trump ‘Surrendered’ to the Coronavirus|July 1, 2020, Page A9"
