"","Publication","Title","Tagline","Author","Category","City","Date"
"201","NYT","Firing a Salvo in Culture Wars, Trump Pushes for Churches to Reopen","President Trump threatened to overrule states that refuse to open places of worship. The White House could not explain how he has that power, and legal experts said he did not have such authority."," Peter Baker","Politics","national","22-May"
"202","NYT","Supreme Court, in 5-4 Decision, Rejects Church’s Challenge to Shutdown Order","A California church argued that restrictions on public gatherings treated houses of worship worse than many businesses."," Adam Liptak","U.S.","national","30-May"
"203","NYT",NA,NA,NA,NA,"national",NA
"204","NYT","How Many Covid Deaths? Don’t Ask President Trump","The president has expressed skepticism about the fatality figures reported to him by his own experts."," The Editorial Board","Opinion","national","17-May"
"205","NYT","Trump Steps Up Attacks on Mail Vote, Making False Claims About Fraud","President Trump initially said he might withhold federal funding for Michigan and Nevada if the states moved forward in expanding vote by mail, though he later backed off that threat."," Reid J. Epstein, Nick Corasaniti and Annie Karni","Politics","national","20-May"
"206","NYT","My Futile Struggle for Stillness","I am isolating in a Mexican village, alternating between being impressed by my capacity for serenity and wanting to strangle myself for descending into triteness of Eat, Pray, Love proportions."," Belen Fernandez","Opinion","national","24-May"
"207","NYT","G.O.P. Officials Quietly Consider Paring Back Convention","President Trump has insisted that the Republican convention is moving ahead for August despite the coronavirus. But even he has expressed openness to a scaled-down event."," Maggie Haberman and Annie Karni","Politics","national","21-May"
"208","NYT","I Expected War. I Didn’t Expect Trump’s Impeachment or a Pandemic.","Ukraine’s president looks back at what got him through his first year in office."," Volodymyr Zelensky","Opinion","national","20-May"
"209","NYT","Biden Says Trump ‘Surrendered’ to Coronavirus in Blistering Speech","President Trump’s Democratic opponent criticized him for failing to protect the American people from the virus, as it continues to surge in many parts of the country."," Matt Stevens and Thomas Kaplan","Politics","national","30-Jun"
"210","NYT","Trump Is Feeding America’s Coronavirus Nightmare","“It’s going away” only in the president’s delusion."," Nicholas Kristof","Opinion","national","24-Jun"
"211","NYT","Biden Hits Trump’s Coronavirus Response: ‘He’s Worried About Looking Bad’","Joe Biden took aim at President Trump’s approach to the virus: “It’s all whining and self-pity.” In a separate interview, he said he would require mask-wearing in public if he were president."," Reid J. Epstein","Politics","national","25-Jun"
"212","NYT","America Is Too Broken to Fight the Coronavirus","No other developed country is doing so badly."," Michelle Goldberg","Opinion","national","22-Jun"
"213","NYT",NA,NA,NA,NA,"national",NA
"214","NYT","In Tulsa, Trump Plays Down Coronavirus Cases and Demonizes Protesters","President Trump said he wanted to slow coronavirus testing, questioned protesters’ toppling of Confederate monuments across the country and vowed to defeat his presumptive Democratic challenger, former Vice President Joe Biden, in November.",NA,"Politics","national","20-Jun"
"215","NYT","Can We Call Trump a Killer?","There is no way to remove his culpability in the neglectful handling of the coronavirus."," Charles M. Blow","Opinion","national","24-Jun"
"216","NYT","White House Eases Virus Restrictions Except for Those Around Trump","Every staff member and guest in contact with President Trump and Vice President Mike Pence will still have their temperatures taken, be asked their symptom histories and be tested for the coronavirus."," Annie Karni","Politics","national","22-Jun"
"217","NYT","Meet the Supporters Trump Has Lost","A significant majority of people who voted for him in 2016 are planning to do so again. What is different about those who’ve had a change of heart?"," Claire Cain Miller, Kevin Quealy and Nate Cohn","The Upshot","national","1-Jul"
"218","NYT","Two More Trump Staff Members Test Positive for Coronavirus After Tulsa Rally","The workers, who attended the rally, joined six other members of the campaign’s advance team who tested positive before the event."," Annie Karni","Politics","national","22-Jun"
"219","NYT","Trump Faces Mounting Defections From a Once-Loyal Group: Older White Voters","No Democrat has won or broken even with voters over 65 in two decades. But seniors’ dismay about President Trump could change that."," Alexander Burns and Katie Glueck","Politics","national","28-Jun"
"220","NYT","‘We Will Be Doing More Testing,’ Fauci Says, Disputing Trump Claim","At a House hearing, Dr. Anthony S. Fauci contradicted President Trump, saying that neither he nor any other officials he knew of had been asked by the president to slow coronavirus testing."," Reuters","Politics","national","23-Jun"
"221","NYT","Biden Takes Dominant Lead as Voters Reject Trump on Virus and Race","A New York Times/Siena College poll finds that Joseph R. Biden Jr. is ahead of the president by 14 points, leading among women and nonwhite voters and cutting into his support with white voters."," Alexander Burns, Jonathan Martin and Matt Stevens","Politics","national","24-Jun"
"222","NYT","Trump Rally Fizzles as Attendance Falls Short of Campaign’s Expectations","President Trump’s attempt to revive his re-election bid sputtered badly as he traveled to Tulsa for his first mass rally in months but found a small crowd and delivered a disjointed speech."," Michael D. Shear, Maggie Haberman and Astead W. Herndon","Politics","national","20-Jun"
"223","NYT","New Numbers Showing Coronavirus Spread Intrude on a White House in Denial","Both President Trump and Vice President Pence seem oblivious to the new chapter in the pandemic."," Michael D. Shear and Maggie Haberman","Politics","national","26-Jun"
"224","NYT",NA,NA,NA,NA,"national",NA
"225","NYT","‘They Test and They Test’: Trump Brushes Off Rise in Covid-19 Cases","President Trump claimed rising numbers of coronavirus cases as states reopen across the country were due to increased testing."," The Associated Press","Politics","national","20-Jun"
"226","NYT","As the Coronavirus Spreads, Drug Pricing Legislation Remains Stalled","For both parties, taking action to reduce the cost of prescription drugs was a banner policy issue before the coronavirus outbreak. Does it still have a chance?"," Noah Weiland","Politics","national","27-Jun"
"227","NYT","Some Republicans Aren’t in Denial About the Virus. Trump Still Is.","Downplaying the seriousness of the coronavirus has not stopped it from spreading in parts of the U.S."," The Editorial Board","Opinion","national","23-Jun"
"228","NYT","Biden Says Trump ‘Waved the White Flag’","The Democratic challenger goes on offense over the coronavirus: This is your morning tip sheet."," Giovanni Russonello","Politics","national","1-Jul"
"229","NYT","Ahead of Trump Visit, Church Makes Unproven Claim of Virus-Killing Technology","The president went to Phoenix to speak to a group of student supporters."," Jennifer Medina and Kenneth Chang","Politics","national","23-Jun"
"230","NYT","Amid Pandemic and Protests, Trump Rally Fails to Fill Arena","President Trump’s first campaign event since the start of the coronavirus pandemic and the nationwide protests for racial justice drew a smaller crowd than the campaign had hyped."," Ainara Tiefenthäler","Politics","national","20-Jun"
"231","NYT","Trump’s Juneteenth Tweet: A Warning to Protesters at His Tulsa Rally","The president issued a thinly veiled threat to anyone planning to demonstrate at his campaign rally on Saturday, but drew no distinction between peaceful protesters and “looters or lowlifes.”"," Annie Karni and Michael D. Shear","Politics","national","19-Jun"
"232","NYT","Trump Defends China Trade Deal After Adviser Says It’s ‘Over’","Peter Navarro, the White House trade adviser, quickly walked back his remarks, which caused markets to dive."," Ana Swanson","Economy","national","23-Jun"
"233","NYT","Waiting for Trump: Hats, Flags, Little Fear of the Virus","Supporters waiting to attend President Trump’s return to the campaign trail displayed their loyalty to him, though there were empty seats as the program started."," Katie Glueck and Astead W. Herndon","Politics","national","20-Jun"
"234","NYT","Trump Supporters Camp Out Ahead of Tulsa Rally, Despite Virus Risk","Supporters of President Trump lined up outside the BOK Center in Tulsa, Okla., two days ahead of his rally. The president and some of his supporters have shrugged off concerns that the event could spread the coronavirus."," The Associated Press","Politics","national","18-Jun"
"235","NYT",NA,NA,NA,NA,"national",NA
"236","NYT","What to Watch For at Trump’s Tulsa Campaign Rally","Will the thousands of Trump supporters wear masks? What time is the rally? How will President Trump talk about race? What protests will he face? Here’s what you need to know."," Annie Karni, Astead W. Herndon and Katie Glueck","Politics","national","20-Jun"
"237","NYT","Tulsa Officials Plead for Trump to Cancel Rally as Virus Spikes in Oklahoma","President Trump will hold his first campaign rally in months on Saturday in Oklahoma, where infections are rising, and officials there are pleading with him to cancel or hold it outdoors."," Noah Weiland","Politics","national","16-Jun"
"238","NYT","As the Virus Surges in South Florida, a Trump Resort Joins the Rush to Reopen","Miami-Dade County has been hit with about a quarter of the state’s cases. The Doral hotel and golf club there is taking steps to prevent infection, even as many visitors and some workers do not wear masks."," Eric Lipton, Neil Reisner, Steve Eder and Ben Protess","U.S.","national","23-Jun"
"239","NYT","The World Builds a Wall to Keep America Out","America has no monopoly on success."," Farhad Manjoo","Opinion","national","1-Jul"
"240","NYT","Federal Agency Halts Studies of Hydroxychloroquine, Drug Trump Promoted","The National Institutes of Health decided to stop one trial because the drug was unlikely to benefit patients, and another because not enough people enrolled."," Katie Thomas","Health","national","20-Jun"
"241","NYT","Ask Not What President Trump Can Do for You","His made-for-TV rallies can be matters of life and death."," Michelle Cottle","Opinion","national","15-Jun"
"242","NYT","Fact-Checking Trump’s Tulsa Rally: Covid-19, Protesters and Biden","In his first rally in months, President Trump made multiple statements that were false, misleading or lacked evidence."," Linda Qiu and Reid J. Epstein","Politics","national","20-Jun"
"243","NYT","Who Will Face Mitch McConnell in November?","Several states are holding primaries, and virus cases are surging. This is your morning tip sheet."," Giovanni Russonello","Politics","national","23-Jun"
"244","NYT","Jacksonville, Trump’s New Convention Site, Will Now Require Face Masks","Republicans moved their national convention to Florida to avoid social distancing measures and masks, but officials in Jacksonville are mandating new precautions as coronavirus infections surge."," Patricia Mazzei","Politics","national","29-Jun"
"245","NYT","Is Trump Trying to Spread Covid-19?","Does he start each day wondering what expert advice to ignore next?"," Thomas L. Friedman","Opinion","national","16-Jun"
"246","NYT",NA,NA,NA,NA,"national",NA
"247","NYT","Refusing to Wear a Mask Is Like Driving Drunk","Republicans talk a good game about “personal responsibility.” It’s time for President Trump’s supporters to actually display some."," Nicholas Kristof","Opinion","national","1-Jul"
"248","NYT","World War C","The Covid-19 story, told in lies."," Paul Krugman","Opinion","national","30-Jun"
"249","NYT","How Americans Feel About the Country Right Now: Anxious. Hopeful.","Exhausted and angry as they face a series of crises, many voters nevertheless remain optimistic about the future, a poll shows, viewing this moment as a chance for progress, one they can help shape."," Lisa Lerer, Elaina Plott and Lazaro Gamio","Politics","national","27-Jun"
