"","Publication","Title","Tagline","Author","Category","City","Date"
"1","NYT","Biden Says Trump ‘Surrendered’ to Coronavirus in Blistering Speech","President Trump’s Democratic opponent criticized him for failing to protect the American people from the virus, as it continues to surge in many parts of the country."," Matt Stevens and Thomas Kaplan","Politics","national","30-Jun"
"2","NYT","Trump Is Feeding America’s Coronavirus Nightmare","“It’s going away” only in the president’s delusion."," Nicholas Kristof","Opinion","national","24-Jun"
"3","NYT","Biden Hits Trump’s Coronavirus Response: ‘He’s Worried About Looking Bad’","Joe Biden took aim at President Trump’s approach to the virus: “It’s all whining and self-pity.” In a separate interview, he said he would require mask-wearing in public if he were president."," Reid J. Epstein","Politics","national","25-Jun"
"4","NYT","America Is Too Broken to Fight the Coronavirus","No other developed country is doing so badly."," Michelle Goldberg","Opinion","national","22-Jun"
"5","NYT",NA,NA,NA,NA,"national",NA
"6","NYT","In Tulsa, Trump Plays Down Coronavirus Cases and Demonizes Protesters","President Trump said he wanted to slow coronavirus testing, questioned protesters’ toppling of Confederate monuments across the country and vowed to defeat his presumptive Democratic challenger, former Vice President Joe Biden, in November.",NA,"Politics","national","20-Jun"
"7","NYT","Can We Call Trump a Killer?","There is no way to remove his culpability in the neglectful handling of the coronavirus."," Charles M. Blow","Opinion","national","24-Jun"
"8","NYT","White House Eases Virus Restrictions Except for Those Around Trump","Every staff member and guest in contact with President Trump and Vice President Mike Pence will still have their temperatures taken, be asked their symptom histories and be tested for the coronavirus."," Annie Karni","Politics","national","22-Jun"
"9","NYT","Two More Trump Staff Members Test Positive for Coronavirus After Tulsa Rally","The workers, who attended the rally, joined six other members of the campaign’s advance team who tested positive before the event."," Annie Karni","Politics","national","22-Jun"
"10","NYT","Meet the Supporters Trump Has Lost","A significant majority of people who voted for him in 2016 are planning to do so again. What is different about those who’ve had a change of heart?"," Claire Cain Miller, Kevin Quealy and Nate Cohn","The Upshot","national","1-Jul"
"11","NYT","Trump Faces Mounting Defections From a Once-Loyal Group: Older White Voters","No Democrat has won or broken even with voters over 65 in two decades. But seniors’ dismay about President Trump could change that."," Alexander Burns and Katie Glueck","Politics","national","28-Jun"
"12","NYT","‘We Will Be Doing More Testing,’ Fauci Says, Disputing Trump Claim","At a House hearing, Dr. Anthony S. Fauci contradicted President Trump, saying that neither he nor any other officials he knew of had been asked by the president to slow coronavirus testing."," Reuters","Politics","national","23-Jun"
"13","NYT","Biden Takes Dominant Lead as Voters Reject Trump on Virus and Race","A New York Times/Siena College poll finds that Joseph R. Biden Jr. is ahead of the president by 14 points, leading among women and nonwhite voters and cutting into his support with white voters."," Alexander Burns, Jonathan Martin and Matt Stevens","Politics","national","24-Jun"
"14","NYT","New Numbers Showing Coronavirus Spread Intrude on a White House in Denial","Both President Trump and Vice President Pence seem oblivious to the new chapter in the pandemic."," Michael D. Shear and Maggie Haberman","Politics","national","26-Jun"
"15","NYT","Trump Rally Fizzles as Attendance Falls Short of Campaign’s Expectations","President Trump’s attempt to revive his re-election bid sputtered badly as he traveled to Tulsa for his first mass rally in months but found a small crowd and delivered a disjointed speech."," Michael D. Shear, Maggie Haberman and Astead W. Herndon","Politics","national","20-Jun"
"16","NYT",NA,NA,NA,NA,"national",NA
"17","NYT","Biden Says Trump ‘Waved the White Flag’","The Democratic challenger goes on offense over the coronavirus: This is your morning tip sheet."," Giovanni Russonello","Politics","national","1-Jul"
"18","NYT","‘They Test and They Test’: Trump Brushes Off Rise in Covid-19 Cases","President Trump claimed rising numbers of coronavirus cases as states reopen across the country were due to increased testing."," The Associated Press","Politics","national","20-Jun"
"19","NYT","As the Coronavirus Spreads, Drug Pricing Legislation Remains Stalled","For both parties, taking action to reduce the cost of prescription drugs was a banner policy issue before the coronavirus outbreak. Does it still have a chance?"," Noah Weiland","Politics","national","27-Jun"
"20","NYT","Some Republicans Aren’t in Denial About the Virus. Trump Still Is.","Downplaying the seriousness of the coronavirus has not stopped it from spreading in parts of the U.S."," The Editorial Board","Opinion","national","23-Jun"
"21","NYT","Ahead of Trump Visit, Church Makes Unproven Claim of Virus-Killing Technology","The president went to Phoenix to speak to a group of student supporters."," Jennifer Medina and Kenneth Chang","Politics","national","23-Jun"
"22","NYT","Amid Pandemic and Protests, Trump Rally Fails to Fill Arena","President Trump’s first campaign event since the start of the coronavirus pandemic and the nationwide protests for racial justice drew a smaller crowd than the campaign had hyped."," Ainara Tiefenthäler","Politics","national","20-Jun"
"23","NYT","Trump Defends China Trade Deal After Adviser Says It’s ‘Over’","Peter Navarro, the White House trade adviser, quickly walked back his remarks, which caused markets to dive."," Ana Swanson","Economy","national","23-Jun"
"24","NYT","Ahead of Trump Visit, Church Makes Unproven Claim of Virus-Killing Technology","The president went to Phoenix to speak to a group of student supporters."," Jennifer Medina and Kenneth Chang","Politics","national","23-Jun"
"25","NYT","Waiting for Trump: Hats, Flags, Little Fear of the Virus","Supporters waiting to attend President Trump’s return to the campaign trail displayed their loyalty to him, though there were empty seats as the program started."," Katie Glueck and Astead W. Herndon","Politics","national","20-Jun"
"26","NYT","Trump Supporters Camp Out Ahead of Tulsa Rally, Despite Virus Risk","Supporters of President Trump lined up outside the BOK Center in Tulsa, Okla., two days ahead of his rally. The president and some of his supporters have shrugged off concerns that the event could spread the coronavirus."," The Associated Press","Politics","national","18-Jun"
"27","NYT",NA,NA,NA,NA,"national",NA
"28","NYT","What to Watch For at Trump’s Tulsa Campaign Rally","Will the thousands of Trump supporters wear masks? What time is the rally? How will President Trump talk about race? What protests will he face? Here’s what you need to know."," Annie Karni, Astead W. Herndon and Katie Glueck","Politics","national","20-Jun"
"29","NYT","Tulsa Officials Plead for Trump to Cancel Rally as Virus Spikes in Oklahoma","President Trump will hold his first campaign rally in months on Saturday in Oklahoma, where infections are rising, and officials there are pleading with him to cancel or hold it outdoors."," Noah Weiland","Politics","national","16-Jun"
"30","NYT","As the Virus Surges in South Florida, a Trump Resort Joins the Rush to Reopen","Miami-Dade County has been hit with about a quarter of the state’s cases. The Doral hotel and golf club there is taking steps to prevent infection, even as many visitors and some workers do not wear masks."," Eric Lipton, Neil Reisner, Steve Eder and Ben Protess","U.S.","national","23-Jun"
"31","NYT","The World Builds a Wall to Keep America Out","America has no monopoly on success."," Farhad Manjoo","Opinion","national","1-Jul"
"32","NYT","Federal Agency Halts Studies of Hydroxychloroquine, Drug Trump Promoted","The National Institutes of Health decided to stop one trial because the drug was unlikely to benefit patients, and another because not enough people enrolled."," Katie Thomas","Health","national","20-Jun"
"33","NYT","Ask Not What President Trump Can Do for You","His made-for-TV rallies can be matters of life and death."," Michelle Cottle","Opinion","national","15-Jun"
"34","NYT","Ask Not What President Trump Can Do for You","His made-for-TV rallies can be matters of life and death."," Michelle Cottle","Opinion","national","15-Jun"
"35","NYT","Fact-Checking Trump’s Tulsa Rally: Covid-19, Protesters and Biden","In his first rally in months, President Trump made multiple statements that were false, misleading or lacked evidence."," Linda Qiu and Reid J. Epstein","Politics","national","20-Jun"
"36","NYT","Who Will Face Mitch McConnell in November?","Several states are holding primaries, and virus cases are surging. This is your morning tip sheet."," Giovanni Russonello","Politics","national","23-Jun"
"37","NYT","Jacksonville, Trump’s New Convention Site, Will Now Require Face Masks","Republicans moved their national convention to Florida to avoid social distancing measures and masks, but officials in Jacksonville are mandating new precautions as coronavirus infections surge."," Patricia Mazzei","Politics","national","29-Jun"
"38","NYT",NA,NA,NA,NA,"national",NA
"39","NYT","Is Trump Trying to Spread Covid-19?","Does he start each day wondering what expert advice to ignore next?"," Thomas L. Friedman","Opinion","national","16-Jun"
"40","NYT","World War C","The Covid-19 story, told in lies."," Paul Krugman","Opinion","national","30-Jun"
"41","NYT","How Americans Feel About the Country Right Now: Anxious. Hopeful.","Exhausted and angry as they face a series of crises, many voters nevertheless remain optimistic about the future, a poll shows, viewing this moment as a chance for progress, one they can help shape."," Lisa Lerer, Elaina Plott and Lazaro Gamio","Politics","national","27-Jun"
"42","NYT","The Boy Who Cried Fake News","From inside the MAGA gates, Trump can’t see how the world has changed."," Jamelle Bouie","Opinion","national","23-Jun"
"43","NYT","A Plague of Willful Ignorance","Trump has empowered America’s anti-rational streak."," Paul Krugman","Opinion","national","22-Jun"
"44","NYT","Fauci, Citing ‘Disturbing Surge,’ Tells Congress the Virus Is Not Under Control","The testimony of the nation’s top infectious disease expert countered President Trump’s upbeat assessment, describing a “mixed bag” of some bright spots amid worrying trends and unknowns."," Sheryl Gay Stolberg and Noah Weiland","Politics","national","23-Jun"
"45","NYT","House Votes to Limit Health Costs as Drug Maker Adds Price Tag to Virus Treatment","A Democratic measure would cap insurance costs and grant the government the power to negotiate drug costs just as the coronavirus pandemic renews concerns over prices."," Sheryl Gay Stolberg and Noah Weiland","Politics","national","29-Jun"
"46","NYT","China Lashes Out at U.S.’s Action Against Mass Incarcerations","A new law aimed at punishing Chinese officials involved in mass internments of Uighurs and other minorities in Xinjiang came as John Bolton accused President Trump of supporting Beijing’s crackdown."," Steven Lee Myers","Asia Pacific","national","18-Jun"
"47","NYT","Trump Campaign Pushing for Four Debates With Biden","The Trump team wants one more debate than is typically held in the general election, and argued that they should start earlier because the coronavirus may prompt an increase in early voting."," Maggie Haberman","Politics","national","18-Jun"
"48","NYT","Coronavirus Attacks the Lungs. A Federal Agency Just Halted Funding for New Lung Treatments.","The shift, quietly disclosed on a government website, highlights how the Trump administration is favoring development of vaccines over treatments for the sickest patients."," Katie Thomas","Health","national","19-Jun"
"49","NYT",NA,NA,NA,NA,"national",NA
"50","NYT","Public Health Experts Reject President’s View of Fading Pandemic","Contrary to President Trump’s recent comments, specialists say, recent increases are real, and the virus is like a “forest fire” that will burn as long as there is fuel."," James Gorman","Health","national","21-Jun"
"51","NYT","Trump Supporters Must Waive Right to Sue Over Virus to Attend Rally","The sign-up page for the president’s upcoming rally in Tulsa, Okla., includes a disclaimer about the possibility of contracting the coronavirus."," Jenny Gross","Politics","national","11-Jun"
"52","NYT","America Didn’t Give Up on Covid-19. Republicans Did.","Partisanship has crippled our response."," Paul Krugman","Opinion","national","25-Jun"
"53","NYT","Trump’s False Attacks on Voting by Mail Stir Broad Concern","The president’s assertions about widespread fraud have little or no basis in fact but are resonating with his supporters and give him the option of raising doubts about the legitimacy of the outcome."," Maggie Haberman, Nick Corasaniti and Linda Qiu","Politics","national","24-Jun"
"54","NYT","Pence Misleadingly Blames Coronavirus Spikes on Rise in Testing","On a private call with governors, the vice president played down new outbreaks, stressing that some states were seeing what he called “intermittent” spikes. Experts have warned it’s not that simple."," Katie Rogers and Jonathan Martin","Politics","national","15-Jun"
"55","NYT","This Should Be Biden’s Bumper Sticker","He will need a simple, clear message to counter Trump’s “Make America Great Again” trope."," Thomas L. Friedman","Opinion","national","30-Jun"
"56","NYT","A Sheriff Who Defied Arizona’s Lockdown Is Infected With the Coronavirus","Sheriff Mark Lamb said that he believed he was infected at a campaign event on Saturday. He tested positive ahead of a planned meeting with President Trump at the White House this week."," Mihir Zaveri","U.S.","national","18-Jun"
"57","NYT","F.D.A. Revokes Emergency Approval of Malaria Drugs Promoted by Trump","The agency said that a review of some studies showed that the drugs’ potential benefits in treating Covid-19 did not outweigh the risks."," Katie Thomas","Health","national","15-Jun"
"58","NYT","Tulsa Braces for Trump Rally’s Health Threat as Virus Cases Rise","As the city reported its largest single-day increase in cases since March, its top health official said he was “absolutely” worried that the Saturday rally could become a “super spreader” event."," Annie Karni","Politics","national","17-Jun"
"59","NYT","Trump’s Trade Appeals to China Still Left Farmers Reeling","John Bolton, the former national security adviser, alleged that President Trump had pressed China to buy farm goods for political reasons. Those purchases have not made up for the trade-war damage."," Ana Swanson and Alan Rappeport","Economy","national","19-Jun"
"60","NYT",NA,NA,NA,NA,"national",NA
"61","NYT","With the Federal Health Megaphone Silent, States Struggle With a Shifting Pandemic","As state and local governments confront a new wave of coronavirus infections, President Trump is sending mixed messages and Washington’s public health bully pulpit has gone silent."," Sheryl Gay Stolberg, Noah Weiland, Sarah Mervosh and David E. Sanger","Politics","national","17-Jun"
"62","NYT","Trump Will Return to Campaign Trail With Rally in Tulsa","The president’s first rally since the coronavirus shuttered most of the country will take place on Juneteenth, which commemorates the end of slavery, in the city where one of the worst racist massacres in American history took place."," Annie Karni","Politics","national","10-Jun"
"63","NYT","How the Trump Campaign’s Plans for a Triumphant Rally Went Awry","Instead of offering President Trump a glide path back into the campaign season, Saturday’s rally in Tulsa has become yet another flash point for a candidate who has repeatedly displayed insensitivity about race."," Annie Karni, Maggie Haberman and Reid J. Epstein","Politics","national","18-Jun"
"64","NYT","Putin Says U.S. Is in ‘Deep Internal Crisis’","The Russian leader described an America poisoned by racism and violence and paralyzed by the refusal of President Trump’s opponents to accept the 2016 election results."," Andrew Higgins","Europe","national","14-Jun"
"65","NYT","Tribe in South Dakota Seeks Court Ruling Over Standoff on Blocking Virus","The Cheyenne River Sioux Tribe set up checkpoints to limit the spread of the coronavirus. After the state objected, the White House got involved. Now the tribe has asked a federal judge to intervene."," Mark Walker and Emily Cochrane","Politics","national","24-Jun"
"66","NYT","Trump Suspends Visas Allowing Hundreds of Thousands of Foreigners to Work in the U.S.","The move is fiercely opposed by business leaders, who say it will block their ability to recruit critically needed workers from countries overseas."," Michael D. Shear and Miriam Jordan","Politics","national","22-Jun"
"67","NYT","E.U. May Bar American Travelers as It Reopens Borders, Citing Failures on Virus","European Union officials are racing to agree on who can visit the bloc as of July 1 based on how countries of origin are faring with new coronavirus cases. Americans, so far, are excluded, according to draft lists seen by The New York Times."," Matina Stevis-Gridneff","Europe","national","23-Jun"
"68","NYT","As Coronavirus Infections Climb, Washington Moves On to Other Business","New cases are rising in almost half of the states. But in the capital, restless lawmakers and White House officials appear ready to focus on other subjects."," Sheryl Gay Stolberg and Noah Weiland","Politics","national","10-Jun"
"69","NYT","Trump’s ‘What Do You Have to Lose?’ Presidency Is Rallying Again","As an encapsulation of the president’s worldview, some former associates say, there is perhaps no beating the text of a campaign waiver: “guests voluntarily assume all risks.”"," Matt Flegenheimer","Politics","national","20-Jun"
"70","NYT","Judge Orders Roger Stone to Report to Prison Next Month","President Trump’s friend had sought a longer reprieve before he serves his sentence on seven felony convictions, citing the pandemic."," Sharon LaFraniere","Politics","national","26-Jun"
"71","NYT",NA,NA,NA,NA,"national",NA
"72","NYT","Graduating West Point Cadets Isolate for Two Weeks Ahead of Trump Speech","The address comes as the coronavirus spreads — and during a breakdown in relations between the president and the nation’s top military leaders."," Eric Schmitt and Michael D. Shear","Politics","national","12-Jun"
"73","NYT","The Week in Business: Confronting Racist Marketing","Facebook takes on political ads, and (some) small businesses catch a break in aid funding."," Charlotte Cowles","Business","national","21-Jun"
"74","NYT","Trump Will Give Convention Speech in Jacksonville, Capping a Dispute Over Safety","The move from Charlotte, N.C., where the Republican convention was originally planned, came after the president demanded to hold an event without social distancing rules."," Annie Karni","Politics","national","11-Jun"
"75","NYT","Trump and de Blasio: ‘Together, at the Wrong Time in History’","The chief executives of the country and its biggest city have found themselves diminished as leaders, lacking the trust of the people they serve."," Jeremy W. Peters","Politics","national","17-Jun"
"76","NYT","Could Trump Turn a Vaccine Into a Campaign Stunt?","In a desperate search for a boost, he could release a coronavirus vaccine that has not been shown to be safe and effective as an October surprise."," Ezekiel J. Emanuel and Paul A. Offit","Opinion","national","8-Jun"
"77","NYT","Onscreen, the Trump Campaign Ramps Up, and Down","In an anemic rally and a video interview with his son, the president created awkward images and relived a battle with an incline."," James Poniewozik","Television","national","22-Jun"
"78","NYT","U.S. Must Release Children From Family Detention Centers, Judge Rules","The order, which cited the severity of the coronavirus pandemic, applies to children held in the nation’s three family detention centers for more than 20 days."," Miriam Jordan","U.S.","national","26-Jun"
"79","NYT","How the Supreme Court Is Quietly Enabling Trump","Using emergency relief at the court, the administration has imposed controversial policies without a final determination of their legality."," Stephen I. Vladeck","Opinion","national","17-Jun"
"80","NYT","After Asking Americans to Sacrifice in Shutdown, Leaders Failed to Control Virus","As Covid-19 cases surge, it is clear many governors underestimated the coronavirus and rushed to reopen before their states were ready."," Sabrina Tavernise, Frances Robles and Louis Keene","U.S.","national","27-Jun"
"81","NYT","A Winner on Election Day in November? Don’t Count on It","The lack of race results in New York and Kentucky this week is a prelude for the presidential election, as officials strain to deal with a deluge of absentee ballots and a jumble of voting deadlines."," Shane Goldmacher","Politics","national","24-Jun"
"82","NYT",NA,NA,NA,NA,"national",NA
"83","NYT","We’re Feeding America, but We’re Sacrificing Ourselves","Poultry plants continue to run processing lines at a breakneck speed, making it impossible for workers to social distance."," Jerald Brooks and Lakesha Bailey","Opinion","national","15-Jun"
"84","NYT","G.O.P. Faces Risk From Push to Repeal Health Law During Pandemic","Republicans and the Trump administration continue to press to end the Affordable Care Act even as the virus leaves more Americans worried about affordable health coverage."," Sheryl Gay Stolberg","Politics","national","22-Jun"
"85","NYT","Trump Defends Police, but Says He’ll Sign Order Encouraging Better Practices","Joseph R. Biden Jr., his Democratic opponent, accused the president of dividing the country."," Peter Baker and Thomas Kaplan","Politics","national","11-Jun"
"86","NYT","Pandemic’s Cleaner Air Could Reshape What We Know About the Atmosphere","Coronavirus shutdowns have cut pollution, and that’s opened the door to a “giant, global environmental experiment” with potentially far-reaching consequences."," Coral Davenport","Climate","national","25-Jun"
"87","NYT","Federal Executions to Resume Amid a Pandemic and Protests","The administration is pressing ahead with the first federal execution in 17 years as demonstrators seek changes to the criminal justice system and lawyers have trouble visiting death-row clients."," Hailey Fuchs","Politics","national","30-Jun"
"88","NYT","Don’t Leave the W.H.O. Strengthen It.","The organization is still the world’s best hope for fighting pandemics."," The Editorial Board","Sunday Review","national","13-Jun"
"89","NYT","Obamacare Faces Unprecedented Test as Economy Sinks","The battles over the health law have played out during a decade of continuous economic growth. How it performs as a safety net now may help determine its future."," Abby Goodnough and Reed Abelson","Health","national","27-Jun"
"90","NYT","A Mad Scramble to Stock Millions of Malaria Pills, Likely for Nothing","Before the F.D.A. withdrew its waiver to stockpile the drugs as coronavirus treatments, the Trump administration had embarked on a headlong effort to import tens of millions of doses."," Sheryl Gay Stolberg","Politics","national","16-Jun"
"91","NYT","Wave of New Polling Suggests an Erosion of Trump’s Support","Joe Biden appears in a stronger position to oust an incumbent president than any challenger since Bill Clinton in the summer of 1992."," Nate Cohn","The Upshot","national","9-Jun"
"92","NYT","What the Pandemic Reveals About the Male Ego","Why are the rates of coronavirus deaths far lower in many female-led countries?"," Nicholas Kristof","Sunday Review","national","13-Jun"
"93","NYT",NA,NA,NA,NA,"national",NA
"94","NYT","Joe Biden Needs to Learn an Urgent Lesson From the 2004 Election","Bush survived the Iraq war. Trump has mishandled the coronavirus and the protests, but Americans care more about plans going forward."," Michael E. O’Hanlon","Opinion","national","14-Jun"
"95","NYT","Why Joe Biden Should Look to His Left","Progressive ideas don’t just turn out the vote. They win votes."," Sean McElwee","Opinion","national","11-Jun"
"96","NYT","On the Future, Americans Can Agree: It Doesn’t Look Good","Battered by a health crisis and boiling over with fury about racial injustice, many voters are mourning the past, worried about the present and fearful of what comes next."," Lisa Lerer and Dave Umhoefer","Politics","national","12-Jun"
"97","NYT","Trump Administration Moves to Solidify Restrictive Immigration Policies","The administration proposed a rule this week that would raise the standard of proof for migrants hoping to obtain asylum and is expected to propose additional visa restrictions."," Zolan Kanno-Youngs and Maggie Haberman","Politics","national","12-Jun"
"98","NYT","This Time, Hardly Anyone Followed Trump’s Lead on Virus Drugs","Prescriptions soared after the president began promoting two antimalarial drugs to treat coronavirus infections. Nothing of the sort happened when he later announced he was taking one of them."," Ellen Gabler and Michael H. Keller","U.S.","national","4-Jun"
"99","NYT","A Conspiracy Made in America May Have Been Spread by Russia","The Americans who pushed a conspiracy theory the night of the Iowa caucuses have migrated to coronavirus conspiracies on Twitter, with help from a very Russia-friendly account."," Nicole Perlroth","Technology","national","15-Jun"
