"","Publication","Title","Tagline","Author","Category","City","Date"
"100","NYT","Trump, Citing Pandemic, Moves to Weaken Two Key Environmental Protections","Twin environmental actions set for Thursday underscored the president’s push to roll back regulations as the coronavirus crisis continues."," Coral Davenport and Lisa Friedman","Climate","national","4-Jun"
"101","NYT","Market Madness in the Pandemic","Why are investors rushing to buy junk?"," Paul Krugman","Opinion","national","15-Jun"
"102","NYT","Congress Steps Up Pressure as Trump Administration Evades Bailout Oversight","As independent watchdogs sound an oversight alarm, House Democrats demand to know who got $500 billion in small-business loans."," Emily Cochrane and Alan Rappeport","Politics","national","15-Jun"
"103","NYT","Farmers Get Billions in Virus Aid, and Democrats Are Wary","As the administration sends up to $16 billion in additional subsidies, critics are concerned that the funds could be used to ensure that the president maintains the backing of one of his key voting blocs."," Sharon LaFraniere","Politics","national","7-Jun"
"104","NYT",NA,NA,NA,NA,"national",NA
"105","NYT","Trump Says Jobs Report Made It a ‘Great Day’ for George Floyd, Stepping on Message","The president’s comments on Mr. Floyd, who died after a police officer knelt on his neck for nearly nine minutes, were immediately criticized by Joseph R. Biden Jr., his Democratic opponent."," Katie Rogers","Politics","national","5-Jun"
"106","NYT","I.M.F. Approves Critical Loan for Ukraine","President Volodymyr Zelensky of Ukraine won an endorsement for his anti-corruption policies with the approval of a $5 billion lending program from the International Monetary Fund."," Andrew E. Kramer","Europe","national","10-Jun"
"107","NYT","‘Pandemic Within a Pandemic’: Coronavirus and Police Brutality Roil Black Communities","The current civil unrest is deeply connected to the racial disparities exposed by the coronavirus crisis. “I’m just as likely to die from a cop as I am from Covid,” one organizer said."," Sheryl Gay Stolberg","Politics","national","7-Jun"
"108","NYT","‘They Let Us Down’: 5 Takeaways on the C.D.C.’s Coronavirus Response","Early mistakes in testing, aging data systems, clashes with President Trump and an overly cautious culture shook confidence in the nation’s premier public health agency."," Michael D. Shear","U.S.","national","3-Jun"
"109","NYT","Philonise Floyd Speaks Out: ‘I’m Here to Ask You to Make It Stop’","Congressional testimony and a new debate over Confederate names: This is your morning tip sheet."," Giovanni Russonello","Politics","national","11-Jun"
"110","NYT","How Times Reporters Handle Scientific Studies","When is research considered reliable? The answer isn’t always fully known. Here’s the approach our journalists take in evaluating studies and their results."," Emily Palmer","Times Insider","national","9-Jun"
"111","NYT","Philonise Floyd Speaks Out: ‘I’m Here to Ask You to Make It Stop’","Congressional testimony and a new debate over Confederate names: This is your morning tip sheet."," Giovanni Russonello","Politics","national","11-Jun"
"112","NYT","Trump Administration Faces Bipartisan Calls to End Citizenship Delays","Lawmakers from both parties are urging the Trump administration to conduct the oath remotely to make up for a pause in naturalization ceremonies during the health crisis."," Miriam Jordan","U.S.","national","17-Jun"
"113","NYT","Republicans Will Move Trump Convention Speech Out of Charlotte","After a stalemate with Democrats in North Carolina, Republicans said the president wouldn’t accept the party’s nomination at its convention in Charlotte, as planned, but would do so in another city."," Annie Karni","Politics","national","2-Jun"
"114","NYT","Trump ‘Remains Healthy’ After Taking Hydroxychloroquine, His Doctor Says","The president has hailed the drug as a cure for Covid-19, but his own health officials have questioned its effectiveness and safety. His doctor’s comments were part of a summary of the president’s health."," Katie Rogers and Lawrence K. Altman","Politics","national","3-Jun"
"115","NYT",NA,NA,NA,NA,"national",NA
"116","NYT","Despite Big Promises, U.S. Has Delivered Limited Aid in Global Virus Response","The State Department and U.S.A.I.D. have spent a fraction of the humanitarian assistance that Congress approved in March to help curb the coronavirus."," Lara Jakes","Politics","national","7-Jun"
"117","NYT","When Voters Discuss Coronavirus, They’re Really Talking About Trump","Even though most people don’t name the coronavirus as their top voting issue, President Trump’s response to the outbreak, and how it’s perceived, will probably swing the election."," Giovanni Russonello","Politics","national","29-May"
"118","NYT","Trump Announces That the U.S. Will Withdraw From the W.H.O.","President Trump said he would terminate the United States’ relationship with the World Health Organization, and repeated past charges that China had mishandled the coronavirus outbreak.",NA,"Politics","national","29-May"
"119","NYT","Fed Warns of ‘Extraordinarily Uncertain’ Path to Recovery","Assessing the pandemic’s impact, a Federal Reserve report sees strains on businesses and households and a fragile road back to steady growth and employment."," Jeanna Smialek","Economy","national","12-Jun"
"120","NYT","Trump Administration Selects Five Coronavirus Vaccine Candidates as Finalists","The White House is eager to project progress, but the public-private partnership it has created still faces scientific hurdles, internal tensions and questions from Congress."," Noah Weiland and David E. Sanger","Politics","national","3-Jun"
"121","NYT","Trump Postpones G7 Summit and Calls for Russia to Attend","The president said he also planned to invite South Korea, Australia and India to the meeting of world leaders in order to discuss China’s future."," Maggie Haberman","Politics","national","30-May"
"122","NYT","Biden’s Testing Strategy Sets Up a Clear Contrast With Trump on the Coronavirus","While the president has left testing responsibilities to the states, his Democratic rival would harness the power of the federal government to drive testing down to the workplace."," Sheryl Gay Stolberg","Politics","national","28-May"
"123","NYT","Don’t Bar Ex-Offenders From Coronavirus Aid Funds","The Trump administration unilaterally excluded those with criminal records from loan programs. The decision should be reversed."," Cyrus R. Vance Jr.","Opinion","national","2-Jun"
"124","NYT","Donald Trump Is Lost in Space","The president is incapable of summoning the better angels of our nature. He doesn’t even seem to know what they are."," Gail Collins and Bret Stephens","Opinion","national","2-Jun"
"125","NYT","Biden Calls Trump a ‘Fool’ for Not Wearing Mask in Coronavirus Crisis","Joseph Biden, in his first in-person interview since the virus curtailed his campaign, suggested the president was being “falsely masculine’’ by refusing to wear a mask."," Sydney Ember","Politics","national","26-May"
"126","NYT",NA,NA,NA,NA,"national",NA
"127","NYT","U.S. Limits Virus Aid for Masks, Gloves and Other Medical Gear Abroad","But the U.S. Agency for International Development will allow relief workers to buy personal protective equipment that is produced in the places it would be used."," Lara Jakes","Politics","national","9-Jun"
"128","NYT","Senate Confirms Inspector General to Oversee Virus Bailout Funds","Brian D. Miller, the White House lawyer tapped to oversee the Treasury Department’s $500 billion fund, has said he would not be influenced by political pressure."," Alan Rappeport","Politics","national","2-Jun"
"129","NYT","The Medical Mask Becomes a Protest Symbol","Commentators on the right have tried to paint the mask as a cowardly affectation. A flood of masked demonstrators tells a different story."," Amanda Hess","Arts","national","2-Jun"
"130","NYT","Trump Thinks He’s 2020’s ‘Law and Order’ Candidate. He’s Not.","Trump’s plan to campaign as the second coming of Richard Nixon shows the limits of historical analogy. It’s not 1968."," Jamelle Bouie","Opinion","national","2-Jun"
"131","NYT","It’s Trump vs. Twitter","President Trump is taking aim at social networks over treatment of his tweets. Twitter responded by putting a warning on another of his posts.",NA,"DealBook","national","29-May"
"132","NYT","ISIS Attacks Surge in Iraq Amid Debate on U.S. Troop Levels","The growing pressure on the United States to reduce its military presence in Iraq comes as strikes by the Islamic State are on the rise."," Alissa J. Rubin, Lara Jakes and Eric Schmitt","Middle East","national","10-Jun"
"133","NYT","Embattled at Home, Trump Finds Himself Isolated Abroad, Too","After years of snubs and American unilateralism, European allies have stopped looking to the president for leadership, and are turning their backs on him."," Steven Erlanger","Europe","national","2-Jun"
"134","NYT","Coronavirus to Shave Trillions From the Economy Over 10 Years","The Congressional Budget Office projects a nearly $16 trillion hit to the gross domestic product over the next decade, $7.9 trillion after adjusting for inflation."," Emily Cochrane","Politics","national","1-Jun"
"135","NYT","Rebuking China, Trump Curtails Ties to Hong Kong and Severs Them With W.H.O.","Critics say the actions would do little to blunt China’s influence and could ultimately hurt the U.S. and others."," Michael Crowley, Edward Wong and Ana Swanson","Politics","national","29-May"
"136","NYT","Gretchen Whitmer: The Coronavirus Is a Civil Rights Battle, Too","George Floyd’s death and the pandemic both reveal American infections. Why is the federal government undermining my fight against them?"," Gretchen Whitmer","Opinion","national","2-Jun"
"137","NYT",NA,NA,NA,NA,"national",NA
"138","NYT","Amid Pandemic and Upheaval, New Cyberthreats to the Presidential Election","Fear of the coronavirus is speeding up efforts to allow voting from home, but some of them pose security risks and may make it easier for Vladimir V. Putin, or others, to hack the vote."," David E. Sanger, Nicole Perlroth and Matthew Rosenberg","Politics","national","7-Jun"
"139","NYT","Blaming China for Pandemic, Trump Says U.S. Will Leave the W.H.O.","America’s decades-long relationship with the organization has been instrumental in improving health around the world."," Donald G. McNeil Jr. and Andrew Jacobs","Health","national","29-May"
"140","NYT","U.S. and Chinese Scientists Trace Evolution of Coronaviruses in Bats","Researchers whose canceled U.S. grant caused an outcry from other scientists urge preventive monitoring of viruses in southwestern China."," James Gorman","Science","national","1-Jun"
"141","NYT","Trump Will Have His Coronation","If North Carolina won’t host the Republican Party’s convention, he’ll find a state that will."," Michelle Cottle","Opinion","national","27-May"
"142","NYT","The C.D.C. Waited ‘Its Entire Existence for This Moment.’ What Went Wrong?","The technology was old, the data poor, the bureaucracy slow, the guidance confusing, the administration not in agreement. The coronavirus shook the world’s premier health agency, creating a loss of confidence and hampering the U.S. response to the crisis."," Eric Lipton, Abby Goodnough, Michael D. Shear, Megan Twohey, Apoorva Mandavilli, Sheri Fink and Mark Walker","U.S.","national","3-Jun"
"143","NYT","As Virus Toll Preoccupies U.S., Rivals Test Limits of American Power","The coronavirus may have changed almost everything, but it didn’t change this: Global competition spins ahead — and in many ways has accelerated."," David E. Sanger, Eric Schmitt and Edward Wong","Politics","national","1-Jun"
"144","NYT","Where the Virus Is Growing Most: Countries With ‘Illiberal Populist’ Leaders","Brazil, Russia, Britain and the U.S. have something in common."," David Leonhardt and Lauren Leatherby","Briefing","national","2-Jun"
"145","NYT","Beyond Georgia: A Warning for November as States Scramble to Expand Vote-by-Mail","Turnout has remained high as states have raced to allow voting by mail. But getting a full count on Election Day looks increasingly difficult."," Nick Corasaniti and Michael Wines","Politics","national","10-Jun"
"146","NYT","Senate Gives Final Approval to Revisions to Small-Business Program","The legislation now heads to the president’s desk, just days before some businesses will run out of time to spend the loan money."," Emily Cochrane","Politics","national","3-Jun"
"147","NYT","China Steps Back in Airline Dispute With the Trump Administration","Beijing will allow limited flights by international carriers to resume after the White House threatened to block Chinese passenger jets from flying to the U.S."," Niraj Chokshi, Ana Swanson and Vivian Wang","Business","national","3-Jun"
"148","NYT",NA,NA,NA,NA,"national",NA
"149","NYT","At Cape Canaveral, Trump’s Search for a Heroic Narrative Is Thwarted","The president had hoped to watch the first launch of NASA astronauts into orbit from the United States in nearly a decade. Nothing would say the U.S. is back with more verve than a rocket’s red glare."," Peter Baker and Michael D. Shear","Politics","national","27-May"
"150","NYT","As Protests Engulf the United States, China Revels in the Unrest","Chinese officials and state media are seizing on the moment to tout Beijing’s authoritarian system and condemn American hypocrisy — a narrative that ignores many of their own issues."," Javier C. Hernández","Asia Pacific","national","2-Jun"
"151","NYT","Border Wall Land Grabs Accelerate as Owners Shelter From Pandemic","With private property proving hard to acquire, the administration has stepped up efforts to secure land on the Mexican border for President Trump’s wall."," Zolan Kanno-Youngs","Politics","national","29-May"
"152","NYT","Falwell’s Blackface Tweet Brings Racial Dissent to Liberty University","A tweet by Liberty University’s president, Jerry Falwell Jr., has sparked an angry protest in the evangelical college’s community and a rare apology from Mr. Falwell."," Elizabeth Williamson","Politics","national","8-Jun"
"153","NYT","Mourning Alone","As the coronavirus death toll crosses 100,000, Americans have been left without a consoler in chief."," Lisa Lerer","Politics","national","28-May"
"154","NYT","Trump Tweets and Golfs, but Makes No Mention of Virus’s Toll","Coronavirus deaths in the United States approached a staggering 100,000, a number the president once predicted would never be reached."," Peter Baker","Politics","national","24-May"
"155","NYT","Trump Tweets and Golfs, but Makes No Mention of Virus’s Toll","Coronavirus deaths in the United States approached a staggering 100,000, a number the president once predicted would never be reached."," Peter Baker","Politics","national","24-May"
"156","NYT","In Days of Discord, a President Fans the Flames","Mr. Trump has presented himself as someone who seeks conflict, not conciliation, a fighter, not a peacemaker. And he has lived up to his self-image at a perilous time."," Peter Baker","Politics","national","30-May"
"157","NYT","Black Americans Have a Message for Democrats: Not Being Trump Is Not Enough","Joe Biden wants to heal the soul of the country in this moment of protest and loss, and win the White House. Simply telling people to vote in November may not help with either goal."," Astead W. Herndon","Politics","national","31-May"
"158","NYT","The Brutal Clarity of the Trump-McConnell Plan to Protect Businesses","The liability-protection ruse is an excuse to coerce Americans back to work by refusing desperately needed help."," Will Wilkinson","Opinion","national","25-May"
"159","NYT",NA,NA,NA,NA,"national",NA
"160","NYT","They Predicted ‘The Crisis of 2020’ … in 1991. So How Does This End?","Two scholars coined the term millennial and developed a fan base for their grim theories. Now, the surviving one sees a generational realignment happening in American politics that does not bode well for Republicans."," Jeremy W. Peters","Politics","national","28-May"
"161","NYT","Crisis in the Liberal City","The George Floyd protests expose the fault lines in metropolitan America."," Ross Douthat","Opinion","national","2-Jun"
"162","NYT","Fight Over G.O.P. Convention Escalates in North Carolina","President Trump has pushed state leaders to hold the kind of event he wants. Top Republicans and the state’s Democratic governor traded demands this week over safety measures."," Maggie Haberman and Annie Karni","Politics","national","28-May"
"163","NYT","Sparring and Schedules Offer Glimpse of Pandemic’s Partisan Lens","The White House directly challenges the House’s new rules. President Trump plans to resume in-person fund-raising soon. New York City, Washington and Los Angeles plan to lift some restrictions.",NA,"U.S.","national","29-May"
"164","NYT","In Audacious Move, Georgia and Florida Governors Offer to Host G.O.P. Convention","The party is still contractually obligated to hold the event in North Carolina, but President Trump has threatened a change of location as the state’s Democratic governor urges caution because of the coronavirus."," Maggie Astor","Politics","national","26-May"
"165","NYT","Remember, No One Is Coming to Save Us","Eventually doctors will find a coronavirus vaccine, but black people will continue to wait for a cure for racism."," Roxane Gay","Sunday Review","national","30-May"
"166","NYT","Does a Crisis Spur Political Unity? Not This Pandemic","Insults, accusations and shaming characterize the current political environment even as leaders must come together at some point."," Carl Hulse","U.S.","national","28-May"
"167","NYT","On the Economics of Not Dying","What good is increasing G.D.P. if it kills you?"," Paul Krugman","Opinion","national","28-May"
"168","NYT","Trump Says He Is ‘Considering’ Hosting G7 Summit at Camp David","In a tweet, the president said that gathering world leaders in person would be a sign of “normalization.” None immediately rejected the idea."," Michael Crowley","Politics","national","20-May"
"169","NYT","Trump Suggests Virus Death Count Is Inflated. Most Experts Doubt It","Senior White House and health officials have sought new ways to find the extent of infections and deaths, questioning whether official counts are inflating the toll of the virus."," Noah Weiland, Maggie Haberman and Abby Goodnough","Politics","national","22-May"
"170","NYT",NA,NA,NA,NA,"national",NA
"171","NYT","In Michigan Visit, Trump Forgoes Criticism and Talks About the Economy and the Flood","Touring a Ford plant, he donned a mask but then took it off because he “didn’t want to give the press the pleasure of seeing it.”"," Annie Karni","Politics","national","21-May"
"172","NYT","Prominent Scientists Denounce End to Coronavirus Grant","A group of 77 Nobel laureates wants the U.S. government to review a grant cancellation for research in China directly related to preventing pandemics."," James Gorman","Health","national","21-May"
"173","NYT","Trump Is Playing the China Card. Who Believes Him?","He attacks Joe Biden to deflect blame for his terrible handling of Covid-19 and record of appeasing Beijing."," Susan E. Rice","Opinion","national","19-May"
"174","NYT","Scientists Question Validity of Major Hydroxychloroquine Study","Experts demanded verification of data and methods used in a study of drugs to treat Covid-19. The study suggested the drugs might have increased deaths."," Roni Caryn Rabin","Health","national","29-May"
"175","NYT","He Says Trumps Cost Him $2 Million, but Hotelier Now Cheers Federal Assist","Plans to launch a brand of Trump hotels in Mississippi fizzled when the president’s family business walked away. Now a former partner has received  coronavirus relief loans as he completes the project."," Steve Eder and Ben Protess","U.S.","national","22-May"
"176","NYT","How We Broke the World","Greed and globalization set us up for disaster."," Thomas L. Friedman","Sunday Review","national","30-May"
"177","NYT","Trump’s Press Secretary Displays One of His Checks in a Little Too Much Detail","The $100,000 check was made out to a government agency. This time his account and routing numbers were clearly visible."," Annie Karni","Politics","national","22-May"
"178","NYT","In Praise of Fallible Leaders","We need a president who can admit it when he’s wrong."," Paul Krugman","Opinion","national","25-May"
"179","NYT","Malaria Drug Taken by Trump Is Tied to Increased Risk of Heart Problems and Death in New Study","The drugs did not help coronavirus patients, and should not be used outside clinical trials, researchers said."," Denise Grady","Health","national","22-May"
"180","NYT","Trump’s Inaccurate Claims on Hydroxychloroquine","The president falsely described scientific research around the malaria drug, falsely denied the existence of a federal warning against it and argued, with no evidence, that large numbers of health care workers were taking it."," Linda Qiu","Politics","national","21-May"
"181","NYT",NA,NA,NA,NA,"national",NA
"182","NYT","Crumbs for the Hungry but Windfalls for the Rich","Billions are going to zillionaires under the guise of pandemic relief."," Nicholas Kristof","Sunday Review","national","23-May"
"183","NYT","For Spy Agencies, Briefing Trump Is a Test of Holding His Attention","President Trump’s intelligence briefings have gotten renewed attention since he blamed them for failing to sound the alarm early on about the coronavirus."," Julian E. Barnes and Adam Goldman","Politics","national","21-May"
"184","NYT","‘This Is Not the Hunger Games’: National Testing Strategy Draws Concerns","The Trump administration’s report to Congress sees states taking responsibility for coronavirus testing with federal guidance."," Apoorva Mandavilli and Catie Edmondson","Health","national","25-May"
"185","NYT","America Is a Tinderbox","Scenes from a country in free fall."," Michelle Goldberg","Opinion","national","29-May"
"186","NYT","Trump Sows Doubt on Voting. It Keeps Some People Up at Night.","A group of worst-case scenario planners — mostly Democrats, but also some anti-Trump Republicans — have been gaming out how to respond to various doomsday options for the 2020 presidential election."," Reid J. Epstein","Politics","national","24-May"
"187","NYT","It’s My 100th Birthday. It’s Been Quite a Century.","I grew up in the Great Depression and served in World War II. Trust me when I say America will survive this crisis, too."," Arthur E. Rowse","Opinion","national","23-May"
"188","NYT","Pressure Mounts Over Calls for Guantánamo’s Most Isolated Prisoners","Amid the coronavirus pandemic, two judges have ordered the government to arrange classified calls between some detainees and their lawyers, or explain why not."," Carol Rosenberg","Politics","national","29-May"
"189","NYT","What to Know About the Malaria Drug Trump Says He Is Using","Here are the facts on hydroxychloroquine, which the president has promoted to fight Covid-19 despite warnings from the F.D.A. that it can cause heart problems."," Denise Grady, Katie Thomas, Patrick J. Lyons and Neil Vigdor","U.S.","national","18-May"
"190","NYT","As Trump Pushes for Reopenings, Congregations Choose Safety Over Haste","Houses of worship are balancing the desire to reopen and worship together against the health consequences of moving too fast."," Rick Rojas and Elizabeth Dias","U.S.","national","24-May"
"191","NYT","Four Months After First Case, U.S. Death Toll Passes 100,000","Scientists are revising the timeline of how the virus spread. Education Secretary Betsy DeVos said she would direct public school districts to share federal aid with private schools.",NA,"U.S.","national","27-May"
"192","NYT",NA,NA,NA,NA,"national",NA
"193","NYT","Donald Trump Doesn’t Want Authority","The coronavirus crisis offered the president an opportunity to consolidate power. It turns out he only wants attention."," Ross Douthat","Opinion","national","19-May"
"194","NYT","China’s Hong Kong Crackdown Could Put Trump in an Unwelcome Spot","A proposed new security law has senators calling for sanctions. But the president is reluctant to jeopardize his ties to President Xi Jinping."," Michael Crowley and Edward Wong","Politics","national","21-May"
"195","NYT","Reopening Optimism Helps Wall Street","The latest on stock market and business news during the coronavirus outbreak.",NA,"Business","national","27-May"
"196","NYT","We’ve Got Way Too Many Trumps","The next generation’s terrible trio, and two we’ll leave alone."," Gail Collins","Opinion","national","20-May"
"197","NYT","Trump Looks Forward to the Return of Sports With Crowds","The president called in to the broadcast of the golf tour’s first live TV event since the coronavirus pandemic shuttered tournaments."," Bill Pennington","Golf","national","17-May"
"198","NYT","Trump Says He’s Taking Hydroxychloroquine, Prompting Warning From Health Experts","His announcement drew immediate criticism from a range of medical experts, who warned not just of the dangers it posed for the president’s health but also of the example it set."," Annie Karni and Katie Thomas","Politics","national","18-May"
"199","NYT","Trump Looks Forward to the Return of Sports With Crowds","The president called in to the broadcast of the golf tour’s first live TV event since the coronavirus pandemic shuttered tournaments."," Bill Pennington","Golf","national","17-May"
"200","NYT","On Politics: Putting a Stamp (or Not) on Vote-by-Mail","President Trump makes false claims, and Mike Pompeo faces scrutiny: This is your morning tip sheet."," Giovanni Russonello","Politics","national","21-May"
